,caption,image_file,image_id
2442,die frau fährt mit den fahrrad über eine brücke,./data/resized_val_set/3385430506.jpg,3385430506
2443,eine tennisspielerin in typischer kleidung versucht mit dem schläger einen über ihr fliegenden ball zu treffen,./data/resized_val_set/3388094307.jpg,3388094307
2444,eine frau spielt cello,./data/resized_val_set/3388618374.jpg,3388618374
2445,menschen vor einem stand,./data/resized_val_set/3393274529.jpg,3393274529
2446,eine frau mit hund sitzt auf einer bank vor parkenden autos,./data/resized_val_set/3394654132.jpg,3394654132
2447,ein kleiner junge beim spiel auf einer elektrischen gitarre,./data/resized_val_set/3394992905.jpg,3394992905
2448,eine frau sitzt hinter einer theke,./data/resized_val_set/3395176505.jpg,3395176505
2449,drei menschen in einem wohnzimmer mit kamin und weihnachtsbaum,./data/resized_val_set/339642119.jpg,339642119
2450,ein hund fängt einen gelben ball im flug,./data/resized_val_set/3396817186.jpg,3396817186
2451,ein mann reitet auf einem stier,./data/resized_val_set/3405759441.jpg,3405759441
2452,asiatische kinder duschen nackt unter einem wasserstrahl,./data/resized_val_set/3410899419.jpg,3410899419
2453,springender hund mit ball im maul,./data/resized_val_set/3415165462.jpg,3415165462
2454,fans zeige ihre unterstützung in einer halle,./data/resized_val_set/3416617727.jpg,3416617727
2455,ein mann mit einem grünen stirnband hält einen tennisschläger,./data/resized_val_set/3425851292.jpg,3425851292
2456,zwei mädchen stehen nebeneinander ung grinsen,./data/resized_val_set/3427023324.jpg,3427023324
2457,kinder tanzen ballett,./data/resized_val_set/3433259846.jpg,3433259846
2458,zwei frauen rennen und springen über eine hügelige landschaft,./data/resized_val_set/3435015880.jpg,3435015880
2459,tanzende frauen in bunten kostümen,./data/resized_val_set/3435208408.jpg,3435208408
2460,ein mountainbiker fährt im wald,./data/resized_val_set/3435233065.jpg,3435233065
2461,fußgänger gehen an der straße entlang,./data/resized_val_set/3435371117.jpg,3435371117
2462,eine frau fotografiert im abendlicht,./data/resized_val_set/3445428367.jpg,3445428367
2463,eine junge frau wirft einen bumerang,./data/resized_val_set/344865045.jpg,344865045
2464,ein motocross fahrer auf einem staubigen feld,./data/resized_val_set/3450158776.jpg,3450158776
2465,ein mädchen sitzt in einem eimer wasser,./data/resized_val_set/3451623753.jpg,3451623753
2466,die zwei hunde sind im flur,./data/resized_val_set/3458577912.jpg,3458577912
2467,ein kleines kind mit nuckel und rotem oberteil gießt wasser aus einem gartenschlauch in die vertiefung eines baumes,./data/resized_val_set/3460992366.jpg,3460992366
2468,ein junger mann macht einen sprung mit einem fahrrad in der halfpipe,./data/resized_val_set/3463034205.jpg,3463034205
2469,einen älteren herren der den tisch deckt,./data/resized_val_set/3463342991.jpg,3463342991
2470,ein mann in einem rosafarbenen hemd und schwarze shorts sind der platz mit seinem begleiter brille,./data/resized_val_set/3470703538.jpg,3470703538
2471,eine frau springt vom baum,./data/resized_val_set/347186933.jpg,347186933
2472,ein kleines mädchen mit helm balanciert über einen über ein gewässer liegenden baum,./data/resized_val_set/3473635435.jpg,3473635435
2473,ein hund springt über ein hindernis in einem parcours,./data/resized_val_set/3474999131.jpg,3474999131
2474,zwei kinder einer im rotweißen der andere im blauweißen fußballdress spielen fußball,./data/resized_val_set/3477672764.jpg,3477672764
2475,eine gruppe menschen mit fahrrädern steht auf einem platz,./data/resized_val_set/3481556478.jpg,3481556478
2476,zuseher bei einem stierkampf der torrero mit weißer hose wendet den stoß des stieres ab,./data/resized_val_set/3482314155.jpg,3482314155
2477,ein kleiner junge jagt enten,./data/resized_val_set/3486324591.jpg,3486324591
2478,ein hund läuft auf dem gehweg,./data/resized_val_set/3488087117.jpg,3488087117
2479,zwei kinder spielen in einem kulissenspiel ritter und prinzessin,./data/resized_val_set/3498240367.jpg,3498240367
2480,zwei arbeiter befestigen etwas an einem kran,./data/resized_val_set/34988312.jpg,34988312
2481,zwei hunde spielen neben einem zaun,./data/resized_val_set/3500342526.jpg,3500342526
2482,männer und frauen sind über blau boxen und rauchen,./data/resized_val_set/3503021545.jpg,3503021545
2483,ein weißer hund springt ins wasser,./data/resized_val_set/3504275465.jpg,3504275465
2484,ein mann mit hut fotografiert eine alte eisentür,./data/resized_val_set/3505701438.jpg,3505701438
2485,ein kleines mädchen spielt draußen mit einem großen ball,./data/resized_val_set/3508389675.jpg,3508389675
2486,ein boxer trainiert in einer sporthalle,./data/resized_val_set/3510218982.jpg,3510218982
2487,mehrere junge menschen hüpfen und springen am strand,./data/resized_val_set/3520079657.jpg,3520079657
2488,die frau spielt geige vor der wand mit den vielen aushängen,./data/resized_val_set/3520199925.jpg,3520199925
2489,wanderer auf einem schneebedeckten berg,./data/resized_val_set/3525041739.jpg,3525041739
2490,ein junger mann springt mit einem skateboard eine treppe hinunter,./data/resized_val_set/3541483943.jpg,3541483943
2491,drei junge indische männer gehen an einem zelt vorbei,./data/resized_val_set/3553374585.jpg,3553374585
2492,ein mädchen bläst ine ine pusteblume auf einer wiese,./data/resized_val_set/3560771491.jpg,3560771491
2493,ein junge in grüngelbem trainingsanzug trainiert kickboxen,./data/resized_val_set/356242936.jpg,356242936
2494,eine frau un ein mann stehen auf einer wiese,./data/resized_val_set/3562537872.jpg,3562537872
2495,ein kleines mädchen läuft grinsend auf die kamera zu,./data/resized_val_set/3569329986.jpg,3569329986
2496,ein älterer mann in militärischer gala uniform neben einer frau,./data/resized_val_set/3569420080.jpg,3569420080
2497,ausgelassen feiernde leute auf einer party,./data/resized_val_set/3571996084.jpg,3571996084
2498,ein pärchen geht umarmt eine straße entlang ein passant kommt entgegen,./data/resized_val_set/3572548523.jpg,3572548523
2499,ein mann spielt im beisein eines anderen an einer orgel,./data/resized_val_set/3575947093.jpg,3575947093
2500,viele leute bei einer veranstaltung,./data/resized_val_set/3578318751.jpg,3578318751
2501,das fahrende auto wirbelt staub auf,./data/resized_val_set/3578841731.jpg,3578841731
2502,der mann redet vor der gruppe von männern und frauen auf dem rasen,./data/resized_val_set/3578945620.jpg,3578945620
2503,zwei männer mit bärten sitzen nebeneinander,./data/resized_val_set/3579150322.jpg,3579150322
2504,ein junger fussballer,./data/resized_val_set/3580375310.jpg,3580375310
2505,man sieht eine person vermutlich einen mann auf einem fahrrad fahren,./data/resized_val_set/358114269.jpg,358114269
2506,ein mann im meer schüttelt seine nassen haare und man sieht das wasser spritzen,./data/resized_val_set/3582920844.jpg,3582920844
2507,zwei clowns im sand,./data/resized_val_set/3590653633.jpg,3590653633
2508,ein mädchen liegt hinter einem zaun mit einer schildkröte in der wiese und zeigt daumen hoch,./data/resized_val_set/3595956590.jpg,3595956590
2509,ein mountainbiker bei einem sprung mit seinem rad,./data/resized_val_set/3607489370.jpg,3607489370
2510,ein mann hängt an einem fallschirm und gleitet der erde entgegen,./data/resized_val_set/3608585041.jpg,3608585041
2511,junge frau als bedienung in einem kaffee,./data/resized_val_set/3610460852.jpg,3610460852
2512,ein pärchen fährt fahrrad,./data/resized_val_set/3615175165.jpg,3615175165
2513,drei männer mit musikinstrumenten in einem studio,./data/resized_val_set/3619232550.jpg,3619232550
2514,zwei durch ein netz getrennte menschen im schwimmbad spielen wasserball,./data/resized_val_set/3621717946.jpg,3621717946
2515,die menschen sitzen in der frühlingssonne,./data/resized_val_set/3629489568.jpg,3629489568
2516,die zwei jungen spiele miteinander,./data/resized_val_set/3630332976.jpg,3630332976
2517,eine frau fotografiert auf einer belebten strasse,./data/resized_val_set/3634828052.jpg,3634828052
2518,eine frau trägt einen großen zylinderhut in den farben großbritaniens,./data/resized_val_set/3649382413.jpg,3649382413
2519,die frau schminkt sich und der junge hält ihr den spiegel hin,./data/resized_val_set/3652150541.jpg,3652150541
2520,einige männer stehen zwischen marktständen,./data/resized_val_set/3654674895.jpg,3654674895
2521,ein mann fährt von einer menschenmenge umringt auf einem hohen einrad,./data/resized_val_set/365849741.jpg,365849741
2522,ein kind vor einem auto das sich die hände an einem spritzenden wasserschlauch nass macht,./data/resized_val_set/3663793993.jpg,3663793993
2523,die kinder spielen mit verschiedenen spielzeug,./data/resized_val_set/3664781437.jpg,3664781437
2524,ein mann mit kind in den armen lehnt gegen eine wand,./data/resized_val_set/366567420.jpg,366567420
2525,eine lächelnde person mit zwei goldmedaillen um den hals macht das victoryzeichen in die kamera,./data/resized_val_set/3667157255.jpg,3667157255
2526,ein rugbyspieler hat einen spieler der gegenmannschaft im würgegriff,./data/resized_val_set/3667822570.jpg,3667822570
2527,zwei junge mädchen grinsen und essen von einem teller,./data/resized_val_set/3669564923.jpg,3669564923
2528,eine frau setzt einem kleinen mädchen einen fahrradhelm auf,./data/resized_val_set/3670131152.jpg,3670131152
2529,ein streetdancer führt seine kunst vor vielen zuschauern vor,./data/resized_val_set/3670205710.jpg,3670205710
2530,ein junge spielt am rasen mit zwei bälllen,./data/resized_val_set/3677318686.jpg,3677318686
2531,auf einem bett steht ein mädchen in pinkem kleid mit geschlossenen augen,./data/resized_val_set/3677702372.jpg,3677702372
2532,ein mann steht mit einerbraunen westerngitarre auf der bühne und singt während er einen weissen hut trägt,./data/resized_val_set/3678885320.jpg,3678885320
2533,einen mann mit vielen ketten armbänder und einer flagge,./data/resized_val_set/3679405397.jpg,3679405397
2534,ein mann und eine frau die einen tanz trainieren wobei der mann gerade eine grätsche macht,./data/resized_val_set/3681967973.jpg,3681967973
2535,eine person fotografiert eine andere person wie diese sich mit zwei hunden auf freiem gelände beschäftigt,./data/resized_val_set/369047365.jpg,369047365
2536,ein mann unterhaltet einen trick mit dem feuer vor der publik,./data/resized_val_set/3691394196.jpg,3691394196
2537,ein hund läuft einen zaun entlang,./data/resized_val_set/3693961165.jpg,3693961165
2538,ein motocross fahrer springt über eine bodenwelle,./data/resized_val_set/3697675767.jpg,3697675767
2539,eine frau führt einen trick mit einem fahrrad vor,./data/resized_val_set/3702634572.jpg,3702634572
2540,ein schwarzer hund springt einer frisbeescheibe ins wasser nach,./data/resized_val_set/3711611500.jpg,3711611500
2541,ein mann mit schwarzer haube spielt trompete,./data/resized_val_set/371269133.jpg,371269133
2542,ein skateboarder versucht eine bank hoch zu fahren,./data/resized_val_set/3714551959.jpg,3714551959
2543,ein mann mit brille und blauem shirt sitzt an einem tisch,./data/resized_val_set/3714944115.jpg,3714944115
2544,drei geschääftsleute beim besiegeln eines vertrages,./data/resized_val_set/3715471115.jpg,3715471115
2545,ein kleiner hund mit einem federrock steht vor einer roten wand und spielt mit einem blumengehänge,./data/resized_val_set/3720366614.jpg,3720366614
2546,ein mann führt mit einem fahrrad einen trick auf einer treppe vor,./data/resized_val_set/3726076549.jpg,3726076549
2547,ein mann mit eimer und einem kleinkind am strand,./data/resized_val_set/3730011219.jpg,3730011219
2548,der mann trägt eine fotokamera vor einer bar,./data/resized_val_set/3736180463.jpg,3736180463
2549,ein hund duscht sich unter dem wasserstrahl eines brunnens,./data/resized_val_set/3743157427.jpg,3743157427
2550,ein fischer zeigt seinen muschelfang,./data/resized_val_set/3745030498.jpg,3745030498
2551,zwei männer angeln von einem boot auf einem see,./data/resized_val_set/3745354249.jpg,3745354249
2552,ein mann streicht eine mauer in hellrot,./data/resized_val_set/375955411.jpg,375955411
2553,ein händler hat seine ware am boden vor sich ausgebreitet,./data/resized_val_set/377406355.jpg,377406355
2554,ein junger mann und eine junge frau gehen telefenierend einen bürgersteig entlang,./data/resized_val_set/3776965455.jpg,3776965455
2555,kleinkinder in mannschaftstrikots spielen vor einem fußballtor,./data/resized_val_set/37791887.jpg,37791887
2556,eine malerin beim malen auf der leinwand,./data/resized_val_set/3783987753.jpg,3783987753
2557,zwei asiatische kinder,./data/resized_val_set/3788779998.jpg,3788779998
2558,einige menschen stehen an einer haltestelle und beobachten ein auto und einen bus,./data/resized_val_set/3789378919.jpg,3789378919
2559,männer beim cricketspiel,./data/resized_val_set/379505240.jpg,379505240
2560,die person mit schwarzer hose und gelbem helm seilt sich in einem hochseilgarten ab,./data/resized_val_set/3800969923.jpg,3800969923
2561,der hund schwimmt,./data/resized_val_set/381239475.jpg,381239475
2562,eine gruppe von männern die mit ihrem dunkelblauem auto und sehr viel gepäck auf dem dach die reise beginnen,./data/resized_val_set/3815142931.jpg,3815142931
2563,ein ralleywagen mit badewanne auf dem dach,./data/resized_val_set/3815669424.jpg,3815669424
2564,ein trompeter musiziert auf der bühne,./data/resized_val_set/381748680.jpg,381748680
2565,ein älterer mann mit hut schweißt einen rahmen,./data/resized_val_set/3818131656.jpg,3818131656
2566,die frauen kaufen etwas auf der straße,./data/resized_val_set/3826408509.jpg,3826408509
2567,eine alte frau sitz am straßenrand und häckelt,./data/resized_val_set/3827301652.jpg,3827301652
2568,eine große auswahl wird hier angeboten,./data/resized_val_set/3831874776.jpg,3831874776
2569,mehrere motorräder stehen am strassenrand,./data/resized_val_set/3831987297.jpg,3831987297
2570,ein bankangestellter hinter dem schalter,./data/resized_val_set/3833511502.jpg,3833511502
2571,ein mann steht vor einer bemalten wand,./data/resized_val_set/383595746.jpg,383595746
2572,ein mann sitzt am computer und arbeitet,./data/resized_val_set/384080245.jpg,384080245
2573,zwei radfahrer mit roter weste radeln die straße entlang,./data/resized_val_set/384465575.jpg,384465575
2574,ein vietnamesisches mädchen das ein kissen tägt,./data/resized_val_set/3847453204.jpg,3847453204
2575,eine person steht an einem see und guckt in die ferne,./data/resized_val_set/3849580150.jpg,3849580150
2576,zei jungs spielen ein partyspiel auf einer spielekonsole,./data/resized_val_set/3859199015.jpg,3859199015
2577,ein mann klettert auf einem umgefallenen baumstamm herum,./data/resized_val_set/386470686.jpg,386470686
2578,am strand zwei schwarze männer mit ihrem fischerboot und fang beobachtet von frauen,./data/resized_val_set/3867308040.jpg,3867308040
2579,ein mann in einem roten mittelalterkostüm hält eine axt,./data/resized_val_set/3868284371.jpg,3868284371
2580,familie beim baden im meer,./data/resized_val_set/3871177631.jpg,3871177631
2581,blick durch ein gitter auf wachhäuschen in einer einfahrt,./data/resized_val_set/3897459678.jpg,3897459678
2582,ein mädchen riecht an einem steinpilz den ihre mutter ihr zeigt,./data/resized_val_set/3899250752.jpg,3899250752
2583,zwei frauen rauchen vor einem geschäft,./data/resized_val_set/39024981.jpg,39024981
2584,ein berittener polizist führt seine streife durch,./data/resized_val_set/390921095.jpg,390921095
2585,ein hund spielt selbst im schnee,./data/resized_val_set/391723162.jpg,391723162
2586,ein mann fotografiert einen see mit bäumen davor,./data/resized_val_set/3925836925.jpg,3925836925
2587,eine frau melkt kühe,./data/resized_val_set/3927396708.jpg,3927396708
2588,ein mann an der spitze einer demonstration hält ein plakat vor sich,./data/resized_val_set/3929379436.jpg,3929379436
2589,zwei kleine mädchen beim basketball spielen,./data/resized_val_set/3944169186.jpg,3944169186
2590,eine frau im bikini schlägt ein rad am strand,./data/resized_val_set/3948003394.jpg,3948003394
2591,ein mann spielt musik auf seiner gitarre,./data/resized_val_set/3970617963.jpg,3970617963
2592,zwei frauen mit einem colaglas,./data/resized_val_set/3970645807.jpg,3970645807
2593,ein junge liegt in einem krankenbett,./data/resized_val_set/3972836203.jpg,3972836203
2594,zwei männer unterhalten sich,./data/resized_val_set/3977684660.jpg,3977684660
2595,zwei hunde auf einem parkettboden,./data/resized_val_set/397815951.jpg,397815951
2596,das wasser im tempel wird befüllt,./data/resized_val_set/3987140887.jpg,3987140887
2597,ein mann liegt vor einer geöffneten haustür im hohen schnee,./data/resized_val_set/398946421.jpg,398946421
2598,ein viatnamesisches mädchen streichelt ein braunes reh,./data/resized_val_set/3996889070.jpg,3996889070
2599,eine frau wirft eine spielgerät,./data/resized_val_set/4017326833.jpg,4017326833
2600,ein mann im rollstuhl wird durch eine bibliothek geschoben,./data/resized_val_set/4033018747.jpg,4033018747
2601,zwei junge hunde spielen im schnee,./data/resized_val_set/405253184.jpg,405253184
2602,spaß beim putzen,./data/resized_val_set/4060351788.jpg,4060351788
2603,ein schiedsrichter und zwei eishockeyspieler blicken zu boden,./data/resized_val_set/4061778099.jpg,4061778099
2604,zuschauer beobachten die läufer eines marathons,./data/resized_val_set/4074473431.jpg,4074473431
2605,eine orientalische tanzgruppe bei einer vorführung auf der bühne,./data/resized_val_set/4082808690.jpg,4082808690
2606,zwei kinder stehen auf dem elephant,./data/resized_val_set/4084139686.jpg,4084139686
2607,frau mit der gitarre beim proben,./data/resized_val_set/4089583280.jpg,4089583280
2608,menschen stehen vor tafeln mit asiatischen schriftzeichen,./data/resized_val_set/4095232321.jpg,4095232321
2609,ein junge sitzt auf einer mauer am strand,./data/resized_val_set/4113033557.jpg,4113033557
2610,menschenmenge in der nacht vor einer lichterkette,./data/resized_val_set/4115261994.jpg,4115261994
2611,ein hund gräbt im schnee,./data/resized_val_set/413231421.jpg,413231421
2612,menschen lagern an einem steinigen hang,./data/resized_val_set/413737417.jpg,413737417
2613,der mann bezahlt an der kasse,./data/resized_val_set/4145119743.jpg,4145119743
2614,ein dunkelhäutiger mann schneidet einem anderen dunkelhäutigen mann die haare,./data/resized_val_set/4146483752.jpg,4146483752
2615,einem schwarzen benommenem mann wird von anderen schwarzen am kopf herumgefummelt,./data/resized_val_set/4146533978.jpg,4146533978
2616,eine gruppe touristen vor einem chinesischne tempel,./data/resized_val_set/4152802063.jpg,4152802063
2617,nur sachschaden beim unfall,./data/resized_val_set/416933689.jpg,416933689
2618,zwei männer bedienen viele leute an einer bar,./data/resized_val_set/4170746161.jpg,4170746161
2619,menschen warten auf einem bahnsteig,./data/resized_val_set/4175969090.jpg,4175969090
2620,eine gruppe kinder sitzt auf stühlen,./data/resized_val_set/4185308266.jpg,4185308266
2621,mehrere musiker stehen auf einer bühne wobei einer das mikrophon zum mund hält,./data/resized_val_set/419638730.jpg,419638730
2622,ein sänger hält das mikrofon in die menge vor der bühne,./data/resized_val_set/4196898728.jpg,4196898728
2623,eine frau mit einem schneidebrett mit zitronenschalen vor ihr am boden,./data/resized_val_set/4213476956.jpg,4213476956
2624,ein mann dessen rücken zu sehen ist stellt eine leiter auf während im vordergrund werzeug und behälter bereitgestellt wurden,./data/resized_val_set/4272747342.jpg,4272747342
2625,ein kellner in weiß bringt einer frau ihre bestellung,./data/resized_val_set/4289135695.jpg,4289135695
2626,eine frau mit schwarzen sachen bei einer art künstlerischer arbeit,./data/resized_val_set/4294773353.jpg,4294773353
2627,eine turnerin führt eine übung mit einem roten ball vor,./data/resized_val_set/4302249704.jpg,4302249704
2628,ein mann macht die skulpturen aus schnee,./data/resized_val_set/4322208721.jpg,4322208721
2629,zwei schlittenhunde ziehen einen schlitten durch den schnee,./data/resized_val_set/4326926923.jpg,4326926923
2630,ein dirigent dirigiert musiker,./data/resized_val_set/432870699.jpg,432870699
2631,zwei asiatische mädchen spielen mit den hände,./data/resized_val_set/4329179652.jpg,4329179652
2632,ein mädchen formt mit mehl einen hügel,./data/resized_val_set/4329198220.jpg,4329198220
2633,eine frau spielt ein instrument,./data/resized_val_set/4344231645.jpg,4344231645
2634,ein mann spielt ein computerspiel mit einem controller,./data/resized_val_set/434642339.jpg,434642339
2635,ein mann liegt neben einigen tanks,./data/resized_val_set/4353551949.jpg,4353551949
2636,der mann muss den schnee räumen und die räder sind eingefroren,./data/resized_val_set/4358650450.jpg,4358650450
2637,mehrere menschen mit schottischer kleidung und trommeln stehen im kreis,./data/resized_val_set/4371749436.jpg,4371749436
2638,ein junges mädchen läuft eis,./data/resized_val_set/4379493825.jpg,4379493825
2639,menschen bei einer laufsportveranstaltung,./data/resized_val_set/4379588756.jpg,4379588756
2640,menschen stehen auf einer bühne,./data/resized_val_set/4390537722.jpg,4390537722
2641,ein paar restaurantmitarbeiter machen pause,./data/resized_val_set/439348091.jpg,439348091
2642,ein kleines mädchen in weißem kleid steht auf dem grünen ufer eines schmalen gewässers,./data/resized_val_set/4397975773.jpg,4397975773
2643,eine frau hält ein microphon in der hand,./data/resized_val_set/4406961500.jpg,4406961500
2644,zwei kinder machen ballet auf einer bühne,./data/resized_val_set/4407490214.jpg,4407490214
2645,ein mann mit buggy und eine frau gehen eine straße entlang während ein junge auf einem roller voraus sich nach ihnen umblickt,./data/resized_val_set/4408414886.jpg,4408414886
2646,die band lynyrd skynyrd während eines auftritts,./data/resized_val_set/4411745355.jpg,4411745355
2647,ein paar sitzt auf einer bank und beobachtet ein schiff,./data/resized_val_set/44129946.jpg,44129946
2648,bäume neben einer straße,./data/resized_val_set/4433551085.jpg,4433551085
2649,mehrere menschen in einem zimmer,./data/resized_val_set/44341119.jpg,44341119
2650,drei straßenmusiker machen musik während menschen zuhören oder vorbeigehen,./data/resized_val_set/4441274429.jpg,4441274429
2651,ein bärtiger mann mit jesuskreuz blickt in die kamera,./data/resized_val_set/4442382200.jpg,4442382200
2652,zwei kinder klettern auf einem spielgerüst,./data/resized_val_set/4442442651.jpg,4442442651
2653,ein mann stitz auf einem steinpodest vor einer ziegelmauer,./data/resized_val_set/4442764150.jpg,4442764150
2654,mehrere personen gehen den gehweg einer innenstadtstraße entlang,./data/resized_val_set/4443087970.jpg,4443087970
2655,zwei türkische männer verkaufen döner an einem imbissstand in einer straße,./data/resized_val_set/4443536449.jpg,4443536449
2656,eine frau mit lockigen haaren und gelbgrünem schal schaut zu boden,./data/resized_val_set/4448923515.jpg,4448923515
2657,eine asiatin mit grauem haar trägt eine kappe und eine sonnenbrille,./data/resized_val_set/4450689424.jpg,4450689424
2658,menschen vor einem großen gebäude mit säulen,./data/resized_val_set/4470667650.jpg,4470667650
2659,zwei menschen untersuchen einen betäubten tiger,./data/resized_val_set/4477467862.jpg,4477467862
2660,ein paar schaut sich die schaufensterauslage an,./data/resized_val_set/4477602852.jpg,4477602852
2661,ein wanderer sitzt auf dem weg und zeigt nach vorne,./data/resized_val_set/448252603.jpg,448252603
2662,vater und sohn bauen einen gasgrill zusammen,./data/resized_val_set/4483432356.jpg,4483432356
2663,drei frauen überqueren einen großen platz eine davon macht fotos,./data/resized_val_set/4483752409.jpg,4483752409
2664,ein junge in einem blauem mantel und kapuze telefoniert in einer fußgängerzone,./data/resized_val_set/4483989917.jpg,4483989917
2665,ein junge arbeitet an schienen,./data/resized_val_set/4484638832.jpg,4484638832
2666,ein kleines mädchen steckt sich hinter der bauen wand,./data/resized_val_set/4491246659.jpg,4491246659
2667,ein junger mann mit einem lustigen runden rucksack steht bei einem mobilen donutstand,./data/resized_val_set/4493390025.jpg,4493390025
2668,ein alter mann mit nacktem oberkörper hält ein tablett auf den knien,./data/resized_val_set/44953142.jpg,44953142
2669,farbiger mann mit hut und sonnenbrille an einer straßenecke unter dem straßenschild van wagner,./data/resized_val_set/4496551407.jpg,4496551407
2670,obdachlose unterhalten sich,./data/resized_val_set/4502384999.jpg,4502384999
2671,die leute auf dem markt,./data/resized_val_set/450746926.jpg,450746926
2672,ein mann mit zwei kindern kreuzt die straße,./data/resized_val_set/4507760036.jpg,4507760036
2673,ein älterer herr mit zigarre geht in der stadt am gehsteig und liest zeitung,./data/resized_val_set/4508496980.jpg,4508496980
2674,farbige musikannten mit guitarre strohut und weißen anzügen spielen musik,./data/resized_val_set/4513166936.jpg,4513166936
2675,ein hund fängt eine frisbyscheibe im flug,./data/resized_val_set/451597318.jpg,451597318
2676,die ubahnhaltestelle vila madalena mit wartenden passagieren,./data/resized_val_set/4523659515.jpg,4523659515
2677,drei kleine kinder in einem käfig,./data/resized_val_set/452419961.jpg,452419961
2678,ein mann und eine frau stehen vor einem monument,./data/resized_val_set/4525768834.jpg,4525768834
2679,eine ältere dame mit rosafarbenden schrim einer roten jack und einer roten tasche läuft auf dem fussgängerweg durch die stadt,./data/resized_val_set/4526155267.jpg,4526155267
2680,kinder beim baseball spielen,./data/resized_val_set/4528304009.jpg,4528304009
2681,zwei frauen in blauen hosenanzügen sitzen nebeneinander auf einer erhöhten fläche auf dem steinernen boden,./data/resized_val_set/4531004667.jpg,4531004667
