,caption,image_file,image_id
3836,ein mann schläft im zug und hat eine toilettenpapierrolle neben sich auf dem tisch liegen,./data/resized_val_set/4921249499.jpg,4921249499
3837,ein asiate der ein werkzeug trägt lächelt direkt in die kamera,./data/resized_val_set/4925702921.jpg,4925702921
3838,sitzende frau mit ihrem handy,./data/resized_val_set/4929777339.jpg,4929777339
3839,auf pferden reitende leute befinden sich auf einer ranch,./data/resized_val_set/4931289200.jpg,4931289200
3840,die zwei kinder die frau und der mann stehen zusammen vor dem fluss,./data/resized_val_set/4933973457.jpg,4933973457
3841,ein kleiner junge mit blau beschmiertem mund hält einen finger unter den wasserhahn,./data/resized_val_set/4934470318.jpg,4934470318
3842,mehrere kinder halten sich am geänder eines drehenden karussels fest,./data/resized_val_set/493654365.jpg,493654365
3843,ein mann und eine frau demonstrieren für pressefreiheit,./data/resized_val_set/4938920379.jpg,4938920379
3844,ein handwerker arbeitet draußen vor dem haus,./data/resized_val_set/493937377.jpg,493937377
3845,ein älterer mann der gemütlich auf einer parkbank sitzt und die umgebung beobachtet,./data/resized_val_set/4940604843.jpg,4940604843
3846,eine frau fortgeschrittenen alters schaut durch das teleobjektiv einer standkamera während sie sich in der natur an einem bach befindet,./data/resized_val_set/4942732639.jpg,4942732639
3847,ein mann sitzt auf einem sims an einer bunten hauswand,./data/resized_val_set/4946431326.jpg,4946431326
3848,ein mann vor einem schaufenster,./data/resized_val_set/4950818767.jpg,4950818767
3849,zwei frauen sitzen mit blick auf einen shop auf einer bank,./data/resized_val_set/4951335575.jpg,4951335575
3850,ein alter mann sitzt auf einer klappkiste mitten in der wallachei,./data/resized_val_set/4956455528.jpg,4956455528
3851,ein mann in rockerkleidung und tattoos schaut nach links,./data/resized_val_set/4957325128.jpg,4957325128
3852,ein angler sitzt alleine mit seiner rute an einem hafenbecken,./data/resized_val_set/4959315763.jpg,4959315763
3853,eine person vor einem banner auf einer parkbank sitzend,./data/resized_val_set/4960801678.jpg,4960801678
3854,ein mann transportiert mit einem fahrrad einen baum auf dem gepäcksträger,./data/resized_val_set/496418696.jpg,496418696
3855,ein junge mit einem gelben shirt steht auf einer strasse,./data/resized_val_set/4964921391.jpg,4964921391
3856,zwei männer und eine frau gehen an einer graphitti wand vorbei,./data/resized_val_set/4968285215.jpg,4968285215
3857,mutter mit blauer kappe vor dem leeren kinderwagen währen der kleine blonde sohn entlang der blumen spaziert,./data/resized_val_set/4968291657.jpg,4968291657
3858,zwei hund spielen auf dem rasen und beißen in einem blaugrünen ball,./data/resized_val_set/496971341.jpg,496971341
3859,ein mann mit einem bunten motorradhelm sitzt auf seinem motorrad,./data/resized_val_set/4970590451.jpg,4970590451
3860,ein hund und drei menschen sind in einer schmalen gasse,./data/resized_val_set/4972988789.jpg,4972988789
3861,frauen arbeiten an ihren beleuchteten ständen in einem dunklen basar,./data/resized_val_set/4979962304.jpg,4979962304
3862,eine frau mit brille hält eine krabbe in der hand und zeigt sie einem blonden jungen,./data/resized_val_set/4980845265.jpg,4980845265
3863,mann und frau tanzen einen standarttanz,./data/resized_val_set/4981438692.jpg,4981438692
3864,menschen durchlaufen ein wasspiel in einer parkanlange,./data/resized_val_set/4983762807.jpg,4983762807
3865,mehrere junge männer schauen grimmig und haben ihre arme gekreuzt,./data/resized_val_set/498444334.jpg,498444334
3866,viele menschen und eine frau im vordergrund die eine grosse tasche auf dem kopf trägt,./data/resized_val_set/4985424423.jpg,4985424423
3867,ein einradfahrer vor publikum in einer stadt,./data/resized_val_set/4985704.jpg,4985704
3868,eine frau sitzt neben der straße und blickt in die menge,./data/resized_val_set/4987509732.jpg,4987509732
3869,zwei männer stehen auf einem bahnhof,./data/resized_val_set/501680472.jpg,501680472
3870,drei männer springen im park,./data/resized_val_set/505004077.jpg,505004077
3871,ein sänger mit mikrofon in der hand beim stagediving,./data/resized_val_set/5056620714.jpg,5056620714
3872,die leute tauchen im schwimmbad,./data/resized_val_set/505837388.jpg,505837388
3873,ein obst und gemüseregel in einem supermarkt,./data/resized_val_set/508838116.jpg,508838116
3874,mehere feuerwehrmänner mit werkzeugen stehen vor zwei sehr stark beschädigten unfall autos,./data/resized_val_set/5123250615.jpg,5123250615
3875,leute stehen an einer kasse im supermarkt,./data/resized_val_set/512616265.jpg,512616265
3876,eine frau welche im begriff ist einen handball aus einer flugphase herraus zu schlagen,./data/resized_val_set/5138003138.jpg,5138003138
3877,ein mann kippt pulver in einen pool,./data/resized_val_set/5142873217.jpg,5142873217
3878,mehrere leute befinden sich mit ihren fahrrädern in einer fahrrad werkstatt,./data/resized_val_set/5176080732.jpg,5176080732
3879,zwei männer boxen in einem boxring,./data/resized_val_set/521529438.jpg,521529438
3880,die frau kniet vor dem tisch und bereitet essen zu,./data/resized_val_set/5216466221.jpg,5216466221
3881,reifenpanne am rennrad,./data/resized_val_set/52226520.jpg,52226520
3882,zwei männer auf dem floß das auf dem wasser grünlich schläft,./data/resized_val_set/5225304863.jpg,5225304863
3883,der mann rutscht auf dem sack durch den sand,./data/resized_val_set/5231178541.jpg,5231178541
3884,ein mann und eine frau unterhalten sich angeregt in einem restaurant,./data/resized_val_set/524073179.jpg,524073179
3885,eine amerikanische soldatengruppe marschiert und wird von einem sergant angeführt,./data/resized_val_set/524296878.jpg,524296878
3886,zwei jungs auf einer straße von oben betrachtet,./data/resized_val_set/526619673.jpg,526619673
3887,ein frau trinkt mit einem strohhalm aus einer kokosnuss,./data/resized_val_set/5273781492.jpg,5273781492
3888,eine junge blonde frau mit blauem sweater und sportjumper lächelt durch ihre sonnebrille,./data/resized_val_set/528500099.jpg,528500099
3889,zwei männer in einer unterhaltung einer an einer spüle,./data/resized_val_set/528517845.jpg,528517845
3890,vater füttert sein baby,./data/resized_val_set/5287405.jpg,5287405
3891,ein mountainbiker ist nach einem sprung in der luft,./data/resized_val_set/5303395266.jpg,5303395266
3892,ein baby mit pinker mütze schläft,./data/resized_val_set/5326961690.jpg,5326961690
3893,zwei mädchen liegen auf einem platz vor einer skulptur,./data/resized_val_set/533602654.jpg,533602654
3894,menschen stehen in london am straßenrand neben einer roten telefonzelle,./data/resized_val_set/5359437945.jpg,5359437945
3895,eine frau im grünen kleid sitzt am boden und häkelt,./data/resized_val_set/5387261695.jpg,5387261695
3896,kinder spielen fussball in einem park,./data/resized_val_set/539705321.jpg,539705321
3897,zei kinder hüpfen in einem trampolin,./data/resized_val_set/5403974988.jpg,5403974988
3898,zwei hunde spielen auf einer wiese,./data/resized_val_set/542648687.jpg,542648687
3899,die band spielt auf der bühne,./data/resized_val_set/5433157092.jpg,5433157092
3900,drei wanderer wandern im tiefen schnee einen hang hoch,./data/resized_val_set/5444535493.jpg,5444535493
3901,menschen waschen sich im fluss,./data/resized_val_set/5455501634.jpg,5455501634
3902,eine frau mit grauem mantel schaut durch ein landscope,./data/resized_val_set/5468460528.jpg,5468460528
3903,ein mädchen wäscht seinen teddybären in einen waschbecken,./data/resized_val_set/5501340599.jpg,5501340599
3904,mann mit brille bart nasenring schaut in die kamera und putzt sich mit einer zahnbürste die zähne,./data/resized_val_set/5507574163.jpg,5507574163
3905,ein skifahrer führt einen akrobatischen trick aus,./data/resized_val_set/5523538212.jpg,5523538212
3906,drei mädchen reiten auf weißen und braunen pferden,./data/resized_val_set/5534272962.jpg,5534272962
3907,eine rothaarige frau föhnt ihre haare,./data/resized_val_set/5543900069.jpg,5543900069
3908,ein restaurantangestellter schneidet dönerfleisch,./data/resized_val_set/5605133486.jpg,5605133486
3909,anlieferung von neuen blumentämmchen durch den großhandel,./data/resized_val_set/561906323.jpg,561906323
3910,eine sängerin steht am mikrofon und hinter ihr sitz der drummer,./data/resized_val_set/5635975939.jpg,5635975939
3911,ein mann hat einen fisch gefangen und zeigt ihn einem mädchen,./data/resized_val_set/566384456.jpg,566384456
3912,ein mann in einem gelben tshirt und mit weißem helm klettert auf einem baum,./data/resized_val_set/570996053.jpg,570996053
3913,ein mann knetet eine braune masse während andere personen drum herum stehen,./data/resized_val_set/5721362205.jpg,5721362205
3914,eine männliche person mit einem gewand steht an einem zaun,./data/resized_val_set/5723818088.jpg,5723818088
3915,eine frau und ein mann unterhalten sich an einem stand mit verschiedenen maritimen objekten,./data/resized_val_set/5727359138.jpg,5727359138
3916,ein älterer mann reinigt den eingangsbereich vor einem gebäude,./data/resized_val_set/5731856709.jpg,5731856709
3917,eine frau sitzt auf einem klappstuhl auf einer straße vor einer mauer und lässt sich von einem stehenden mann mit dreadlocks die haare flechten,./data/resized_val_set/5743380092.jpg,5743380092
3918,ein mann mit warnweste sieht sich straßenmarkierungen an,./data/resized_val_set/5791568.jpg,5791568
3919,ein volleyballer beim annehmen eines balles,./data/resized_val_set/5840232264.jpg,5840232264
3920,ein dunkelhäutiger mann im kochgewand schaut aus einen fenster raus,./data/resized_val_set/59027529.jpg,59027529
3921,sportler alle im sportdress drängelnauf der sandbahn einer sprintet,./data/resized_val_set/5903521315.jpg,5903521315
3922,ein mann in roter mönchstunika fegt den sandigen boden,./data/resized_val_set/5920741851.jpg,5920741851
3923,ein mann mit weißen handschuhen arbeitet in einem labor,./data/resized_val_set/5932908042.jpg,5932908042
3924,ein mann führt zwei esel an einem strick,./data/resized_val_set/5958376440.jpg,5958376440
3925,zwei judokämpfer sind mitten in einem turnier,./data/resized_val_set/5968404576.jpg,5968404576
3926,erschöpftes paar macht ein nickerchen auf einer parkbank,./data/resized_val_set/599235529.jpg,599235529
3927,die frau sitzt und der mann kniet vor mehreren gepäckstücken,./data/resized_val_set/6043197241.jpg,6043197241
3928,ein mann sitzt auf einer rikscha und wartet auf fahrgäste,./data/resized_val_set/6046473448.jpg,6046473448
3929,zwei mädchen in schwarzen und weißen blusen in modelliermasse im studio tätig,./data/resized_val_set/6078212486.jpg,6078212486
3930,ein man läuft ski,./data/resized_val_set/6080521675.jpg,6080521675
3931,auf einer theaterbühne springt ein als harlekin verkleideter mann in die höhe,./data/resized_val_set/6091899771.jpg,6091899771
3932,ein mann sitzt in einem blauen lkw,./data/resized_val_set/6100315.jpg,6100315
3933,ein obdachloser schläft auf seinen habseligkeiten,./data/resized_val_set/6105998656.jpg,6105998656
3934,ein skateboarder führt einen sprung aus,./data/resized_val_set/6157897194.jpg,6157897194
3935,weiß gekleideter mann mit strohhut ruht sich im gestrüpp aus,./data/resized_val_set/61745811.jpg,61745811
3936,ein junge schleckt an einem blauen lutscher und lacht in die kamera,./data/resized_val_set/6178994097.jpg,6178994097
3937,ein mann in einem grünem shirt repariert ein fahrrad,./data/resized_val_set/6186146093.jpg,6186146093
3938,ein junge bastelt ein perlenkette mit grünen perlen,./data/resized_val_set/618797331.jpg,618797331
3939,ein schmied arbeitet in der werkstatt auf einem amboss,./data/resized_val_set/6190349317.jpg,6190349317
3940,ein mann posiert für ein photo in der natur,./data/resized_val_set/619169586.jpg,619169586
3941,ein kampfsportler im schwarzen anzug beim training,./data/resized_val_set/6192034820.jpg,6192034820
3942,ein footballspieler kniet mit dem football auf dem spielfeld,./data/resized_val_set/6199134021.jpg,6199134021
3943,ein auto hat ein fahrrad angefahren und jemand leistet erste hilfe,./data/resized_val_set/6210888137.jpg,6210888137
3944,der junge spielt fußball,./data/resized_val_set/6221289833.jpg,6221289833
3945,eine frau im rotschwarzen sportoutfit läuft durch einen park,./data/resized_val_set/6227789666.jpg,6227789666
3946,zwei boxer im ring beim kampf,./data/resized_val_set/6234467033.jpg,6234467033
3947,frauen beim spielen,./data/resized_val_set/62597667.jpg,62597667
3948,die männer spielen im band,./data/resized_val_set/6269296633.jpg,6269296633
3949,eine frau mit weissem shirt arm und handschutz färht rollschuh,./data/resized_val_set/6273590324.jpg,6273590324
3950,mehrere leute sind beim einkauf,./data/resized_val_set/6274309052.jpg,6274309052
3951,zwei motorräder fahren auf einer rennstrecke,./data/resized_val_set/6276644870.jpg,6276644870
3952,nachdenklich steht ein älterer herr mit gruaer hose und hellem kurzarmhemd auf der straße vor einer bank,./data/resized_val_set/627714170.jpg,627714170
3953,ein läufer mit zwei prothesen trägt eine fahne,./data/resized_val_set/6321643151.jpg,6321643151
3954,die fußballspieler kämpfen um den ball,./data/resized_val_set/6342262756.jpg,6342262756
3955,ein mann in der nonne kleid rennt im marathonlauf,./data/resized_val_set/6371136393.jpg,6371136393
3956,drei jockeys reiten auf ihren pferden,./data/resized_val_set/63787714.jpg,63787714
3957,ein skateboarder macht einen trick vor palmen,./data/resized_val_set/6386779555.jpg,6386779555
3958,ein mann sitzt im stuhl und beobachtet den obelisk,./data/resized_val_set/6408975653.jpg,6408975653
3959,mehrere menschen machen sich in einer badehalle für das turmspringen bereit,./data/resized_val_set/6437497301.jpg,6437497301
3960,ein kleiner bloßfüßiger junge in traditioneller afrikanischer tracht sitzt auf einem holzbrett wartend,./data/resized_val_set/6454057197.jpg,6454057197
3961,ein mann wirft einen gegenstand in das wasser,./data/resized_val_set/6457288631.jpg,6457288631
3962,japaner beim tai chi,./data/resized_val_set/6491222037.jpg,6491222037
3963,zwei boxer stehen im ring,./data/resized_val_set/6502476865.jpg,6502476865
3964,zwei jugendmannschaften spielen rugby,./data/resized_val_set/6524893225.jpg,6524893225
3965,eine weibliche gitarristin singt am mikrofon auf einer bühne,./data/resized_val_set/6532234215.jpg,6532234215
3966,kinder beim kampfsporttraining,./data/resized_val_set/6533934303.jpg,6533934303
3967,eine gruppe von dunkelhäutigen menschen in orangen shirts tanzt auf der straße,./data/resized_val_set/6563237641.jpg,6563237641
3968,eine gruppe von uniformierten frauen spielt auf flöten,./data/resized_val_set/6575547265.jpg,6575547265
3969,ein mann bereitet geflügel zu,./data/resized_val_set/6618942119.jpg,6618942119
3970,ein kind springt von einem rotem sofa,./data/resized_val_set/664341930.jpg,664341930
3971,ein kleindkind und ein baby spielen in einem zimmer voll mit babyspielzeug,./data/resized_val_set/664470170.jpg,664470170
3972,eine familie bereitet das weihnachtsfest vor,./data/resized_val_set/6662693149.jpg,6662693149
3973,der mann mit bart und die frau sitzen und teilen sich das essen vor dem fenster,./data/resized_val_set/6668564001.jpg,6668564001
3974,ein skater vollführt auf einer mauer ein kunststück,./data/resized_val_set/6685838035.jpg,6685838035
3975,der mann sitzt im rtuderboot auf dem wasser vor dem sonnenuntergang,./data/resized_val_set/674513893.jpg,674513893
3976,ein karatekämpfer bringt einen weiteren zu fall,./data/resized_val_set/675153.jpg,675153
3977,fünf jungen männer singen auf der bünne,./data/resized_val_set/6788339456.jpg,6788339456
3978,acht junge leute fahren mit gokarts ein rennen auf der gokartstrecke,./data/resized_val_set/6800484706.jpg,6800484706
3979,ein mann umarmt einen schneemann,./data/resized_val_set/6827875949.jpg,6827875949
3980,ein mann gestikuliert beim erklären,./data/resized_val_set/6838340009.jpg,6838340009
3981,ein arzt versorgt das verletzte knie eines footballspielers,./data/resized_val_set/6839530214.jpg,6839530214
3982,ein junger sänger singt in einem mikrofon und zeigt das viktoryzeichen mit seiner linken hand,./data/resized_val_set/6842319991.jpg,6842319991
3983,ein kleines kind klemmt ein kabel an eine batterie an die ein bestandteil ist von meheren mit kabel verbundenen batterien,./data/resized_val_set/6878446432.jpg,6878446432
3984,ein radfahrer mit blauem helm will sich im straßenverkehr einordnen,./data/resized_val_set/6892085645.jpg,6892085645
3985,die männer sitzen nebeneinander an computern,./data/resized_val_set/6925158300.jpg,6925158300
3986,ein junge spielt mit drei bunten bällen zwischen parkende autos,./data/resized_val_set/6939396159.jpg,6939396159
3987,eine frau und ein mädchen vor einem haus,./data/resized_val_set/6962504000.jpg,6962504000
3988,ein mann mit einem motor,./data/resized_val_set/6966952728.jpg,6966952728
3989,zuschauer beobachten ein tennisspiel bei flutlicht im stadion,./data/resized_val_set/6968761623.jpg,6968761623
3990,ein kind fährt mit seinem snowboard auf einer schneebedeckten fläche,./data/resized_val_set/6981039831.jpg,6981039831
3991,zwei mannschaften bestreiten ein fußballspiel,./data/resized_val_set/7018032339.jpg,7018032339
3992,ein mädchen mit blauem kopftuch steht auf einem platz,./data/resized_val_set/7061176565.jpg,7061176565
3993,ein kleinkind mit grünen shirt putzt sich vor einen spiegel seine zähne,./data/resized_val_set/7062790747.jpg,7062790747
3994,ein rollstuhlfahrer der von einem mann geschoben wird hält eine fackel ähnlich einer olympischen fackel,./data/resized_val_set/7130577881.jpg,7130577881
3995,ein älteres paar lässt sich in einer kirche trauen,./data/resized_val_set/71406758.jpg,71406758
3996,die leichtathleten überspringen die hürden,./data/resized_val_set/7149253081.jpg,7149253081
3997,zwei männer in weiß und grauen shirts betonieren den hof neu,./data/resized_val_set/71521921.jpg,71521921
3998,ein soldat beobachtet den feind,./data/resized_val_set/7175934082.jpg,7175934082
3999,mehrere kindern in bunten sportdresses rot blau gelb mit nummern darauf laufen im schnee,./data/resized_val_set/72218201.jpg,72218201
4000,ein farbiger tanzt vor dem begeisterten publikum,./data/resized_val_set/7277119012.jpg,7277119012
4001,die kindern lahen,./data/resized_val_set/7278335118.jpg,7278335118
4002,zwei männer einer im roten der andere im blauen fußballdress spielen fußball,./data/resized_val_set/7278854458.jpg,7278854458
4003,ein bmxfahrer führt einen trick vor,./data/resized_val_set/7284553600.jpg,7284553600
4004,zwei frauen boxen im ring,./data/resized_val_set/7339914832.jpg,7339914832
4005,zwei motorradrennfahrer legen sich in eine rechtskurve,./data/resized_val_set/7396934178.jpg,7396934178
4006,drei männer beim basketballspielen wovon einer in einem roten shirt den ball gerade gefangen hat,./data/resized_val_set/7402359070.jpg,7402359070
4007,ein springreiter überspringt ein hindernis,./data/resized_val_set/7430281548.jpg,7430281548
4008,eine musikgruppe spielt auf einer bühne,./data/resized_val_set/7455508610.jpg,7455508610
4009,eine fraus sucht auf einem markt nach schallplatten,./data/resized_val_set/7466310132.jpg,7466310132
4010,catamaran unter starkem seitenwind,./data/resized_val_set/7470011060.jpg,7470011060
4011,eine parade mit fahnen auf einer straße,./data/resized_val_set/7517274630.jpg,7517274630
4012,ein mann ist glücklich und hält ein glas in die kamera,./data/resized_val_set/75180828.jpg,75180828
4013,ein musiker mit brille spielt bei einem openair konzert auf einer überdachten bühne elektrische gitarre,./data/resized_val_set/7526370420.jpg,7526370420
4014,vier dungelhäutige kinder sitzen auf der staße und spielen mit leeren gläsern und flaschen,./data/resized_val_set/7529986808.jpg,7529986808
4015,männer auf einer baustelle vor einer ausschachtung,./data/resized_val_set/7544290736.jpg,7544290736
4016,ein mann mit weissen klammoten und einem roten hut fährt auf einem grünen traktor,./data/resized_val_set/755045922.jpg,755045922
4017,drei hunde toben durch wasser,./data/resized_val_set/756909515.jpg,756909515
4018,ein als gaukler gekleideter mann spielt mit einem kind auf der trommel,./data/resized_val_set/757046028.jpg,757046028
4019,fünf poloreiter im gallop von vorn zusehen,./data/resized_val_set/7635804008.jpg,7635804008
4020,ein mann und eine frau bei schießübungen,./data/resized_val_set/7643799764.jpg,7643799764
4021,die männer mit helmen und brillen fahren rennrad auf der strasse,./data/resized_val_set/7669392800.jpg,7669392800
4022,zehn fußballspieler in hellblauem fußballoutfit stehen in eine engen kreis auf dem spielfeld,./data/resized_val_set/7673295758.jpg,7673295758
4023,die menschen besuchen eine messe,./data/resized_val_set/7700377542.jpg,7700377542
4024,ein mann mit bart und sonnenbrille bekleidet mit einem hawaiihemd spielt ein musikinstrument dass wie eine tuba aussieht,./data/resized_val_set/7701250756.jpg,7701250756
4025,junger sportler auf dem rad,./data/resized_val_set/7714755346.jpg,7714755346
4026,zwei frauen sind auf einer veransarltung,./data/resized_val_set/7718605530.jpg,7718605530
4027,ein kleiner junge arbeitet mit einem akkubohrer,./data/resized_val_set/7719524174.jpg,7719524174
4028,zwei teilnehmer eines radrennens kämpfen um ihre position,./data/resized_val_set/7772746168.jpg,7772746168
4029,zwei mädchen im sportdress die ball spielen wobei eines der mädchen die andere im laufen behindert,./data/resized_val_set/7778073672.jpg,7778073672
4030,ein arzt schaut einer weiblichen person in den mund daneben steht ein soldat,./data/resized_val_set/7779718252.jpg,7779718252
4031,einige personen sitzen auf stühlen essen und trinken,./data/resized_val_set/78171801.jpg,78171801
4032,zwei profiradfahrer lachen während der fahrt,./data/resized_val_set/7865722022.jpg,7865722022
4033,mann von hinten auf einer bowlingbahn,./data/resized_val_set/79433987.jpg,79433987
4034,zwei personen in schwarzen anzügen mit jeweils einer roten und einer grünen fliege,./data/resized_val_set/79770548.jpg,79770548
4035,zwei strassenmusiker musizieren zusammen mit ihren gitarren,./data/resized_val_set/7983388093.jpg,7983388093
4036,zwei männer machen karate,./data/resized_val_set/7988459911.jpg,7988459911
4037,drei läufer rennen leichtathletik,./data/resized_val_set/8036608675.jpg,8036608675
4038,ausschnitt eines nfl footballspiels auf höhe der yard line,./data/resized_val_set/8047664455.jpg,8047664455
4039,eine gruppe von männer versammeln sich zum gebet in einer markthalle,./data/resized_val_set/8071166084.jpg,8071166084
4040,zwei orientalische tanzende mädchen auf der bühne,./data/resized_val_set/8116539330.jpg,8116539330
4041,drei kinder spielen,./data/resized_val_set/8133150444.jpg,8133150444
4042,eine gruppe von frauen ist mitten in einem marathon,./data/resized_val_set/8159685316.jpg,8159685316
4043,die frau mit dem surfbrett geht an dem strand vor anderne menschen,./data/resized_val_set/8170813639.jpg,8170813639
4044,ein junge genießt den ausblick von der bergspitze,./data/resized_val_set/8209386413.jpg,8209386413
4045,die frau lässt sich sehr riskant fotografieren,./data/resized_val_set/821605360.jpg,821605360
4046,eine frau steht am straßenrand an einer roten ampel,./data/resized_val_set/8251170369.jpg,8251170369
4047,drei männer unterhalten sich und machen dazu handbewegungen,./data/resized_val_set/82676249.jpg,82676249
4048,zwei schüler stehen an der tafel,./data/resized_val_set/841397013.jpg,841397013
4049,ein kleiner junge mit spielzeugtomahawk spielt im hof,./data/resized_val_set/8443156.jpg,8443156
4050,die männer und die rinder arbeiten auf dem wässrigen feld,./data/resized_val_set/860271719.jpg,860271719
4051,ein mann stellt rosa zuckerwatte her,./data/resized_val_set/86120374.jpg,86120374
4052,die polizei hat wohl eine interne feier,./data/resized_val_set/86131989.jpg,86131989
4053,eine ältere dame mit brille und rosa pullover sitzt in einem geschäft,./data/resized_val_set/91875542.jpg,91875542
4054,männer die in einer telefonzelle am telefonieren sind und im hintergrund einen skyline einer großen stadt,./data/resized_val_set/981727078.jpg,981727078
4055,straßenszene eine frau verlässt gerade eine toilette ud zwei andere frauen unterhalten sich,./data/resized_val_set/991459823.jpg,991459823
4056,bauarbeiter arbeiten auf einer baustelle mit weißem material,./data/resized_val_set/1018148011.jpg,1018148011
4057,es schäft jemand auf der couch,./data/resized_val_set/1029450589.jpg,1029450589
4058,der junge mit dem kopfhörer sitzt auf den schultern der frau,./data/resized_val_set/1029737941.jpg,1029737941
4059,zwei leute in winterkleidung schauen in ein blaues zelt,./data/resized_val_set/103205630.jpg,103205630
4060,ein mann mit roter schwimmweste sitzt auf einem kleinen boot auf einem see,./data/resized_val_set/10350842.jpg,10350842
4061,eine frau mit roten mantel springt in die luft,./data/resized_val_set/1054620089.jpg,1054620089
4062,zwei hunde tollen in der nähe des meeres,./data/resized_val_set/1056873310.jpg,1056873310
4063,ein kleiner junge schlägt mit dem baseballschläger auf den daherfliegenden ball,./data/resized_val_set/1072439304.jpg,1072439304
4064,ein mann telefoniert im zimmer voll mit den büchern,./data/resized_val_set/1073444492.jpg,1073444492
4065,frau mit fahrrand vor bäumen,./data/resized_val_set/1092437557.jpg,1092437557
4066,ein junge auf einem felsen im hintergrund eines blauen himmels,./data/resized_val_set/109671650.jpg,109671650
4067,ein mann fährt ski jet,./data/resized_val_set/109738763.jpg,109738763
4068,die frau mit der mütze und die drei kinder mit den mützen stehen um die blauweisse tonne vor der wand,./data/resized_val_set/109982467.jpg,109982467
4069,die frau sitzt an dem blumenstand auf der belebten strasse,./data/resized_val_set/110269384.jpg,110269384
