,caption,image_file,image_id
0,baumwolllager mit lkw,./data/resized_val_set/1018148011.jpg,1018148011
1,ein mädchen schläft auf dem sofa,./data/resized_val_set/1029450589.jpg,1029450589
2,ein kind hört musik auf den kopfhörern,./data/resized_val_set/1029737941.jpg,1029737941
3,zelten auf dem eis,./data/resized_val_set/103205630.jpg,103205630
4,ein mann fährt einsam auf einem see,./data/resized_val_set/10350842.jpg,10350842
5,eine frau freut sich und springt,./data/resized_val_set/1054620089.jpg,1054620089
6,ein schwarzer und ein brauner hund rennen auf steinigem boden aufeinander zu,./data/resized_val_set/1056873310.jpg,1056873310
7,ein kind beim baseball beim schlag,./data/resized_val_set/1072439304.jpg,1072439304
8,ein mann der zwischen bergen aus büchern sitzt und dabei telefoniert,./data/resized_val_set/1073444492.jpg,1073444492
9,frau mit fahrrad auf einer wiese,./data/resized_val_set/1092437557.jpg,1092437557
10,eine junge steht auf einem felsen,./data/resized_val_set/109671650.jpg,109671650
11,ein snowboarder bei einem sprung vor tannenbäumen,./data/resized_val_set/109738763.jpg,109738763
12,eine frau und drei kinder entsorgen müll,./data/resized_val_set/109982467.jpg,109982467
13,menschen in der bunten ladenpassage,./data/resized_val_set/110269384.jpg,110269384
14,eine weibliche person spielt auf einem instrument,./data/resized_val_set/1107507919.jpg,1107507919
15,ein quad und zwei motorräder fahren auf einer offroadbahn,./data/resized_val_set/112243673.jpg,112243673
16,sich ausruhender mann auf der liege,./data/resized_val_set/1124448967.jpg,1124448967
17,eine gruppe menschen machen party auf der straße,./data/resized_val_set/1126137905.jpg,1126137905
18,traditionell bekleidete frau sitzt in einer hütte vor gewebten stoffen,./data/resized_val_set/1128874064.jpg,1128874064
19,ein paar jugendliche trinken alkohol auf der straße,./data/resized_val_set/1130017585.jpg,1130017585
20,die leute trinken im kneipe,./data/resized_val_set/1141643526.jpg,1141643526
21,ein pärchen auf einer hängebrücke,./data/resized_val_set/1141718391.jpg,1141718391
22,mann jongliert kurzschwerter,./data/resized_val_set/1150429218.jpg,1150429218
23,junge frau biete auf tablett tee an,./data/resized_val_set/1155138244.jpg,1155138244
24,zwei männer stehen auf einem transporter,./data/resized_val_set/116569042.jpg,116569042
25,hunde beim spielen auf einer wiese,./data/resized_val_set/1206506157.jpg,1206506157
26,kin mit baby im zimmer,./data/resized_val_set/120764850.jpg,120764850
27,drei männer gehen auf einer straße wobei man nur den rüken sieht,./data/resized_val_set/121556607.jpg,121556607
28,ein grüner fallschirm wird hinter einem boot hergezogen,./data/resized_val_set/1215804065.jpg,1215804065
29,ein bagger arbeitet auf einer schräge,./data/resized_val_set/123244147.jpg,123244147
30,ein junges mädchen beim laufen,./data/resized_val_set/1235099089.jpg,1235099089
31,rote farbe läuft eine straße entlang udn jemand geht daran vorbei,./data/resized_val_set/123866385.jpg,123866385
32,das ist ein junge der turnt,./data/resized_val_set/126042604.jpg,126042604
33,eine person im roten pulli liegt an einer stange damit es so aussieht als läge sie auf der mauer,./data/resized_val_set/1277949368.jpg,1277949368
34,ein junge versucht seinen vater zu entkommen inmitten eines schauplatzes während im kreis menschen zusehen,./data/resized_val_set/128452798.jpg,128452798
35,menschen in einer bar,./data/resized_val_set/1296770308.jpg,1296770308
36,viele menschen zwischen asiatischen gebäuden,./data/resized_val_set/1306755031.jpg,1306755031
37,das ist ein mann der eine zeitung liest,./data/resized_val_set/1335877186.jpg,1335877186
38,ein hund auf dem rasen trinkt aus einem wasserstrahl,./data/resized_val_set/1341787777.jpg,1341787777
39,fröhlicher junge vor kinderzelt,./data/resized_val_set/1343426964.jpg,1343426964
40,kleines kind fegt mit großem besen,./data/resized_val_set/134642833.jpg,134642833
41,ein mann wirft beim kegeln eine grüne kugel,./data/resized_val_set/1348517311.jpg,1348517311
42,eine band tritt auf einer bühne auf,./data/resized_val_set/134857559.jpg,134857559
43,der alte mann geht mit seinem hund am strand spazieren,./data/resized_val_set/1348947380.jpg,1348947380
44,oldtimer im rennen,./data/resized_val_set/1355945307.jpg,1355945307
45,eine gruppe von kindern tanzt auf einer bühne,./data/resized_val_set/135608578.jpg,135608578
46,das ist ein kleiner junge der einen grossen stein in das wasser wirft,./data/resized_val_set/1358398144.jpg,1358398144
47,zwei frauen in der küche,./data/resized_val_set/135980645.jpg,135980645
48,ein chinesischer schrein und davor tanzt ein drache,./data/resized_val_set/1361790462.jpg,1361790462
49,ein schwarzer hund trägt ein weißes tuch vor sich her in einer pfütze,./data/resized_val_set/1363843090.jpg,1363843090
50,drei hunde beschnüffeln sich gegenseitig,./data/resized_val_set/1368338041.jpg,1368338041
51,zwei männer fahren in einem kajak auf einem fluß im wald,./data/resized_val_set/136886677.jpg,136886677
52,zwei frauen im gruftie stil laufen eine straße entlang,./data/resized_val_set/1389264266.jpg,1389264266
53,in einem kleinen bus sitzen vier mädchen nebeneinander und schauen gemeinsam in ein rosa heft,./data/resized_val_set/1393205795.jpg,1393205795
54,eine gruppe von menschen am strand schaut zum himmel und sieht ein herz,./data/resized_val_set/1394319096.jpg,1394319096
55,ein frau liest ein buch in der öffentlichkeit,./data/resized_val_set/1405665934.jpg,1405665934
56,ein dicker mann mit einem flammen muster hemd nimmt sich gerade besteck,./data/resized_val_set/1409723496.jpg,1409723496
57,der mann mit brille schaut verdutzt,./data/resized_val_set/1410039760.jpg,1410039760
58,surfer auf einer welle,./data/resized_val_set/141126420.jpg,141126420
59,eine frau packt tickets in ihre tasche,./data/resized_val_set/141186473.jpg,141186473
60,vier asiatische frauen sitzt zusammen auf dem boden und lachen,./data/resized_val_set/1432734769.jpg,1432734769
61,ein kunstflieger mit einer roten abgaswolke fliegt neben einem gebäude mit einem turm,./data/resized_val_set/1436832881.jpg,1436832881
62,ein junger mann mit schutzhelm klettert eine felswand herauf,./data/resized_val_set/143688283.jpg,143688283
63,zwei arbeiter die mit einem bagger einen kleinen lkw beladen,./data/resized_val_set/143793054.jpg,143793054
64,weisser jeep mit ladewagen voll mit wasserflaschen steht mitten auf der strasse,./data/resized_val_set/1438769690.jpg,1438769690
65,fröhliche frau mit hut springt oder tanzt auf einer wiese,./data/resized_val_set/144328407.jpg,144328407
66,man sieht nur einen teil eines komplett in gold getauchten mannes mit seinem ebenfalls goldenen fahrrad mitten auf einer straße stehen,./data/resized_val_set/1463864223.jpg,1463864223
67,ein baby guckt auf einen kleinen ast,./data/resized_val_set/146758244.jpg,146758244
68,männer beim reinemachen vor einem aufzug in einem bahnhof,./data/resized_val_set/14868339.jpg,14868339
69,zwei kinder sitzen mit wasserflaschen auf dem boden,./data/resized_val_set/149042906.jpg,149042906
70,viele menschen sind auf einer motorradausstellung,./data/resized_val_set/149231190.jpg,149231190
71,ein kletterer an einer steilen felswand,./data/resized_val_set/1496289999.jpg,1496289999
72,ein mann angelt und eine frau betrachtet den strand,./data/resized_val_set/1499495021.jpg,1499495021
73,ein junge springt in einem trampolin,./data/resized_val_set/1507563902.jpg,1507563902
74,mehrere kinder auf einem ketten karussell,./data/resized_val_set/155014252.jpg,155014252
75,drei buben spielen mit dem großen ball,./data/resized_val_set/1554086730.jpg,1554086730
76,zei soldaten trainieren in der einöde,./data/resized_val_set/156249400.jpg,156249400
77,eine cateringangestellte läuft mit einem essenswagen auf dem weg,./data/resized_val_set/1567005236.jpg,1567005236
78,ein poliszist fährt auf einem motorrad hinter einem auto,./data/resized_val_set/1581304802.jpg,1581304802
79,mann steht einsam am see,./data/resized_val_set/1588931550.jpg,1588931550
80,eine musikkapelle führt ihr stück auf einer grünen wiese und zuschauer auf,./data/resized_val_set/162839055.jpg,162839055
81,menschen auf der strasse,./data/resized_val_set/166774567.jpg,166774567
82,die feuerwehr löscht die brände,./data/resized_val_set/167001809.jpg,167001809
83,eine frau im lila tshirt zeichnet ein portrait,./data/resized_val_set/1680409989.jpg,1680409989
84,zwei kleine kinder spielen patient und doktor,./data/resized_val_set/1680674943.jpg,1680674943
85,zwei frau beim weben,./data/resized_val_set/1717077532.jpg,1717077532
86,eine frau in schwarz marschiert durch den gefallenen schnee,./data/resized_val_set/172892648.jpg,172892648
87,das sind drei männer die für fedex arbeiten,./data/resized_val_set/1732567333.jpg,1732567333
88,ein hund sitzt auf einer wiese,./data/resized_val_set/1745110280.jpg,1745110280
89,der hund läuft die rampe im parkour herunter,./data/resized_val_set/1752454466.jpg,1752454466
90,ein kleiner junge sitzt vor einem tisch,./data/resized_val_set/175369436.jpg,175369436
91,ein asiatischer handwerker arbeite mit einer maschine,./data/resized_val_set/1791491934.jpg,1791491934
92,eine mutter und ihr kind beobachten einen hahn in seinem käfig,./data/resized_val_set/180217379.jpg,180217379
93,ein kleines kind mit einerroten maske streckt sich um an einer tür zu klingeln,./data/resized_val_set/1814391289.jpg,1814391289
94,junger mann mit leuchtschwert,./data/resized_val_set/1836335410.jpg,1836335410
95,eine junge frau singt in ein mikrofon,./data/resized_val_set/1837976956.jpg,1837976956
96,zwei frauen graben in der erde,./data/resized_val_set/1877161207.jpg,1877161207
97,menschen liegen auf den weißen liegestühlen neben rießigen steinen und lassen sich sonnen,./data/resized_val_set/190965502.jpg,190965502
98,boote am ufer eines flüsses,./data/resized_val_set/194197375.jpg,194197375
99,ein junge trägt einen schwarzen sack,./data/resized_val_set/1944813674.jpg,1944813674
100,bärtiger mann beim kochen,./data/resized_val_set/2043372516.jpg,2043372516
101,zwei künstler beim auftritt mit klavier und bass,./data/resized_val_set/205675005.jpg,205675005
102,jugendliche beim tanzen im sonnenuntergang,./data/resized_val_set/2064780645.jpg,2064780645
103,ein hund apportiert einen stock,./data/resized_val_set/2066241589.jpg,2066241589
104,ein wanderer steht auf einem hügel während hinter ihm ein großer berg zusehen ist,./data/resized_val_set/2067833088.jpg,2067833088
105,sech jungen spielen in einem see,./data/resized_val_set/2068403258.jpg,2068403258
106,bei einer veranstaltung stehen eine lachende junge frau in einem ärmellosen top und ein junger mann mit einer portion bunter zuckerwatte nebeneinander,./data/resized_val_set/207015505.jpg,207015505
107,der junge im blauen pullover hebt die hand um seinen lehrerinnen eine antwort zu geben,./data/resized_val_set/2078709661.jpg,2078709661
108,eine frau spricht vor ihrern schülern während eine andere frau zuhört,./data/resized_val_set/2079499010.jpg,2079499010
109,der mann mit mütze und schal lächelt in die kamera,./data/resized_val_set/2081446176.jpg,2081446176
110,ein mann und eine frau gehen über einen zebrastreifen währen die ampel rot ist,./data/resized_val_set/2082620071.jpg,2082620071
111,ein alter mann hebt einen goldenen hung in die kamera,./data/resized_val_set/2082663150.jpg,2082663150
112,ein mann und ein junge treten auf,./data/resized_val_set/2095478050.jpg,2095478050
113,kinder beim wettkampf,./data/resized_val_set/2102902012.jpg,2102902012
114,ein fahrzeug steckt bis zur hälfte im schlamm,./data/resized_val_set/210625425.jpg,210625425
115,frau beim fotografieren,./data/resized_val_set/2109370875.jpg,2109370875
116,das ist ein mann der gitarre spielt,./data/resized_val_set/2112114341.jpg,2112114341
117,ein hund läuft im gebirge durch wasser,./data/resized_val_set/2112661738.jpg,2112661738
118,das kind springt im park in die luft und reckt die hände,./data/resized_val_set/2113592981.jpg,2113592981
119,eine band auf der bühne beim konzert,./data/resized_val_set/21167868.jpg,21167868
120,mehrere demonstranten mit schildern,./data/resized_val_set/212155635.jpg,212155635
121,ein mann steht am grill,./data/resized_val_set/2123858003.jpg,2123858003
122,männer mit hund stehen auf einem bürgersteig,./data/resized_val_set/212536960.jpg,212536960
123,ein junge im gelben tshirt spielt in einer kletterburg,./data/resized_val_set/212857743.jpg,212857743
124,ein lachendes kind in einem roten tshirt vor einem glas saft und obst,./data/resized_val_set/213269168.jpg,213269168
125,ein junger mann geht im gleichschtitt mit zwei frauen eine straße entlang,./data/resized_val_set/213609234.jpg,213609234
126,hunde beim spielen im schnee,./data/resized_val_set/2148916767.jpg,2148916767
127,ein rothaariges mädchen trägt ein spiderman kostüm während es auf einem spielpony sitzt,./data/resized_val_set/2159447283.jpg,2159447283
128,das ist ein mann in einem boot mit dem er auf einem see fährt,./data/resized_val_set/217583047.jpg,217583047
129,wintersportler machen skilanglauf,./data/resized_val_set/2187904131.jpg,2187904131
130,das sind zwei menschen die am strand springen,./data/resized_val_set/2190899457.jpg,2190899457
131,kinder beim baden,./data/resized_val_set/2192026581.jpg,2192026581
132,frauen spielen beachvolleyball,./data/resized_val_set/2206282062.jpg,2206282062
133,mann und frau sitzen am tisch,./data/resized_val_set/2206600240.jpg,2206600240
134,eine frau macht ein bild mit ihren kindern,./data/resized_val_set/2208310655.jpg,2208310655
135,ein golden retriever schwimmt mit einem roten spielzeug durch ein natürliches gewässer,./data/resized_val_set/2209496328.jpg,2209496328
136,das sind fotografen auf der strasse,./data/resized_val_set/2209751.jpg,2209751
137,eine gruppe sitzt auf dem strand am meer während ein mann mit einem strohhut den kindern etwas erklärt,./data/resized_val_set/2210054257.jpg,2210054257
138,kleiner junge krabbelt über einen holzboden,./data/resized_val_set/2212472643.jpg,2212472643
139,ein kind spendet etwas in die dose einer älteren frau der heilsarmee,./data/resized_val_set/2214383094.jpg,2214383094
140,ein hund hat einen ball gefangen,./data/resized_val_set/2219805467.jpg,2219805467
141,ein mann im roten tshirt mit dem schriftzug higher steht neben einem steingebäude,./data/resized_val_set/2219959872.jpg,2219959872
142,ein mann und eine frau sitzen in einem lokal,./data/resized_val_set/2223151597.jpg,2223151597
143,ein band spielt auf einer seebühne,./data/resized_val_set/2224524855.jpg,2224524855
144,zwei alte damen unterhalten sich,./data/resized_val_set/2230971412.jpg,2230971412
145,ein pärchen strickt,./data/resized_val_set/2250479700.jpg,2250479700
146,ein kind mit mütze das auf einem felsen sitzt,./data/resized_val_set/2251418114.jpg,2251418114
147,ein mann mit bierdose und würstchen vor einem grill,./data/resized_val_set/226115048.jpg,226115048
148,ein polizist leckt sich über die lippen während er den karnevalsumzug bewacht,./data/resized_val_set/227689211.jpg,227689211
149,ein müllmann beobachtet in seinem arbeitsanzug den strassenverkehr,./data/resized_val_set/2279729059.jpg,2279729059
150,der kleine hund spielt in den wellen,./data/resized_val_set/2280354512.jpg,2280354512
151,eine band spielt musik auf einem konzert,./data/resized_val_set/2281226546.jpg,2281226546
152,ein gitarrist und zwei geiger die gemeinsam musizieren,./data/resized_val_set/2289754578.jpg,2289754578
153,junger mann an hammondorgel,./data/resized_val_set/2295489839.jpg,2295489839
154,der kleine junge springt mit seiner gelben jacke vergnügt von einem felsblock,./data/resized_val_set/2297744130.jpg,2297744130
155,zwei frauen befinden sich auf einer feier,./data/resized_val_set/230105501.jpg,230105501
156,bauarbeiter arbeiten auf der baustelle,./data/resized_val_set/2310452540.jpg,2310452540
157,der junge mann rasiert sich am strand,./data/resized_val_set/2311881432.jpg,2311881432
158,eien frau packt ein mütze aus die in rose geschenkpapier eingewicket war,./data/resized_val_set/2315320158.jpg,2315320158
159,ein mann sitzt vor der kirchenorgel und spielt einen song,./data/resized_val_set/2319963351.jpg,2319963351
160,ein junger mann hält ein mikrofon in der hand während im hintergrund noch andere leute zus ehen sind,./data/resized_val_set/2324842075.jpg,2324842075
161,ein mann in hoteluniform schiebt einen goldverzierten wagen mit koffern durch eine halle,./data/resized_val_set/2326795765.jpg,2326795765
162,ein hund kommt aus dem schilf gesprungen,./data/resized_val_set/233361142.jpg,233361142
163,ein band spielt seine musik im nachtclub,./data/resized_val_set/2334983049.jpg,2334983049
164,drei hunde spielen im schnee,./data/resized_val_set/2340206885.jpg,2340206885
165,zwei menschen stehen im schatten neben einem baum und der mann trägt einen rucksack,./data/resized_val_set/234580030.jpg,234580030
166,ein hund spielt mit einem ball,./data/resized_val_set/2353119813.jpg,2353119813
167,eine frau kocht in ihrer küche eine suppe,./data/resized_val_set/2354516058.jpg,2354516058
168,eine frau auf einem hof,./data/resized_val_set/2359784186.jpg,2359784186
169,ein mädchen trägt ein anderes huckepack,./data/resized_val_set/2367317953.jpg,2367317953
170,ein kind hat eine faschingsverkleidung als samurai,./data/resized_val_set/2373370266.jpg,2373370266
171,ein skateboarder fährt auf einer rampe,./data/resized_val_set/2374523052.jpg,2374523052
172,ein mann bewegt ein große rad in einer halle,./data/resized_val_set/2376252671.jpg,2376252671
173,mann fährt die touristen übers wasser,./data/resized_val_set/2382847674.jpg,2382847674
174,ein mann telefoniert,./data/resized_val_set/2383712490.jpg,2383712490
175,eine frau wirft einen müllsack in eine mülltonne,./data/resized_val_set/2386635533.jpg,2386635533
176,verkleidete frau schaut in die kamera,./data/resized_val_set/2387197355.jpg,2387197355
177,ein windsurfer auf den wellen,./data/resized_val_set/2396025708.jpg,2396025708
178,eine gruppe asiaten fahren mit dem bus,./data/resized_val_set/2398915100.jpg,2398915100
179,ein gelädenwagenfahrer hat sich fest gefahren,./data/resized_val_set/2409312675.jpg,2409312675
180,spielscene beim american football,./data/resized_val_set/241345721.jpg,241345721
181,der coach redet mit einem seiner rugbyspieler,./data/resized_val_set/241345811.jpg,241345811
182,mädchen mit roten trikots,./data/resized_val_set/241347580.jpg,241347580
183,ein mann im vodergrund während im hingergrund auf dem rasen footballspieler zu sehen sind,./data/resized_val_set/241347611.jpg,241347611
184,ein footballspieler im rotweißen trikot schaut angespannt,./data/resized_val_set/241347803.jpg,241347803
185,der mann macht eine sportliche übung am strand,./data/resized_val_set/2417341107.jpg,2417341107
186,vier junge leute mit turnschuhen und kurzen hosen auf eime weg schauen in die kamera,./data/resized_val_set/2417623030.jpg,2417623030
187,ein vater küsst sein kind,./data/resized_val_set/2420730259.jpg,2420730259
188,band beim auftritt,./data/resized_val_set/2430018178.jpg,2430018178
189,drei frauen und eine baby auf einer decke in einem garten,./data/resized_val_set/2434710077.jpg,2434710077
190,ein älterer asiatischer mann mit kunstvoller kopfbedeckung sitzt am tisch neben einem jungen mit derselben kopfverzierung,./data/resized_val_set/2439942035.jpg,2439942035
191,ein vater und seine tochter spielen auf der blauen rutsche während beide sonnenbrillen tragen,./data/resized_val_set/2445654384.jpg,2445654384
192,ein hund läuft auf einer wiese,./data/resized_val_set/2463067409.jpg,2463067409
193,eine fußballspielerin macht einen einwurf und andere warten auf den ball,./data/resized_val_set/2473956981.jpg,2473956981
194,judoka bei einem wettkampf,./data/resized_val_set/2474483208.jpg,2474483208
195,personen beim sport auf einer wiese,./data/resized_val_set/2474785004.jpg,2474785004
196,ein asiate spielt in einer gasse das instrument zitter,./data/resized_val_set/24759839.jpg,24759839
197,ein hund apportiert einen stock,./data/resized_val_set/2479180530.jpg,2479180530
198,ein mann paddelt mit seinem kanu den bach entlang,./data/resized_val_set/2481490320.jpg,2481490320
199,ein hot dog verkäufer im rot und weiß gestreiften hemd sitzt auf der promenade,./data/resized_val_set/2488783398.jpg,2488783398
200,das ist ein asiatischer fotograf neben vielen blumen,./data/resized_val_set/2490365757.jpg,2490365757
201,zwei männer mit mütze vor einem laden,./data/resized_val_set/2493782805.jpg,2493782805
202,ein mann mit seinem sohn spielen mit dem hund,./data/resized_val_set/2494088238.jpg,2494088238
203,bei einer ballonveranstaltung sitzt ein mann im schatten eines riesigenbunten ballons der gerade aufgeblasen wird,./data/resized_val_set/2500785647.jpg,2500785647
204,ein alter mann mit kopfbedeckung schaut in die kamera,./data/resized_val_set/2502975562.jpg,2502975562
205,eine frau schminkt eine andere frau mit einem weißgoldenen motiv,./data/resized_val_set/2504683345.jpg,2504683345
206,ein mutter mit ihrem kind spielen auf dem spielplatz,./data/resized_val_set/2506113060.jpg,2506113060
207,eine gruppe mensche beobachtet etwas,./data/resized_val_set/2508837436.jpg,2508837436
208,eine gruppe demonstranten zieht durch die allee,./data/resized_val_set/2508850304.jpg,2508850304
209,eine frau mit ihrer tochter schreiben auf ein transparent,./data/resized_val_set/2511787709.jpg,2511787709
210,eine kindergruppe in vietnam auf dem bürgersteig,./data/resized_val_set/2513060654.jpg,2513060654
211,ein rodeoreiter in der arena,./data/resized_val_set/2521794926.jpg,2521794926
212,ein hochzeitspaar beim küssen auf einer wiese,./data/resized_val_set/2526989006.jpg,2526989006
213,gleisarbeiter begutachten das gleis,./data/resized_val_set/2536946133.jpg,2536946133
214,ein gleisarbeiter repariert das gleis,./data/resized_val_set/2537601290.jpg,2537601290
215,das sind arbeiter mit sicherheitswesten,./data/resized_val_set/2537665596.jpg,2537665596
216,ein musikgruppe spielt auf der straße,./data/resized_val_set/2537801630.jpg,2537801630
217,mehrere bauarbeiter arbeiten mit einem bohrer an den gleisen,./data/resized_val_set/2537817814.jpg,2537817814
218,mehrere menschen laufen auf der wiese,./data/resized_val_set/2540751930.jpg,2540751930
219,ein hund läuft durchs wasser,./data/resized_val_set/2541104331.jpg,2541104331
220,mann und frau gehen nebeneinander über eine straße,./data/resized_val_set/2550027486.jpg,2550027486
221,ein mann der gerade eine straßenampel wartet,./data/resized_val_set/2563482243.jpg,2563482243
222,zwei kleine kinder in gelben regenmänteln spielen im watt,./data/resized_val_set/2565847129.jpg,2565847129
223,die achterbahn fährt einen looping so dass die gäste überkopf in der luft hängen,./data/resized_val_set/2579268572.jpg,2579268572
224,eine frau und ein kleiner junge sitzen zusammen in einem sessel,./data/resized_val_set/2579699529.jpg,2579699529
225,mehrer menschen stehen nebeneinander,./data/resized_val_set/2580215443.jpg,2580215443
226,ein mädchen mit rot gepunkteter badekappe schwimmt die bahn entlang,./data/resized_val_set/2592398210.jpg,2592398210
227,ein junge mit einem hut lacht auf einem spielplatz,./data/resized_val_set/2594042571.jpg,2594042571
228,ein kleines kind läuft durch eine pfütze,./data/resized_val_set/2594459477.jpg,2594459477
229,ein mädchen mit blonden haaren isst gerade ein stück kuchen,./data/resized_val_set/2597088734.jpg,2597088734
230,drei männer und eine frau reparieren ein fahrrad,./data/resized_val_set/2600229816.jpg,2600229816
231,ein hechelnder nasser hund in einem see,./data/resized_val_set/2613209320.jpg,2613209320
232,ein windzerzauster hund läuft mit einem ball im maul über eine wiese,./data/resized_val_set/2613993276.jpg,2613993276
233,das sind viele menschen,./data/resized_val_set/2621771656.jpg,2621771656
234,der mann hängt kopfüber vom baum herunter,./data/resized_val_set/262439544.jpg,262439544
235,eine geile blondine und ihr loserfreund stehen an einem shop,./data/resized_val_set/2632429064.jpg,2632429064
236,ein junge mit einem orangenen tshirt inmitten von anderen kindern grinst in die kamera,./data/resized_val_set/2636663855.jpg,2636663855
237,zwei kinder sitzten am rand eines stadtbrunnens,./data/resized_val_set/2638054798.jpg,2638054798
238,ein mann macht sich bereit zum kanufahren,./data/resized_val_set/2641770481.jpg,2641770481
239,ein älterer herr tritt aus einer menschengruppe im dunkeln an die sonne,./data/resized_val_set/2644302353.jpg,2644302353
240,menschen sitzen an einer theke,./data/resized_val_set/264461048.jpg,264461048
241,der junge springt von einem bett zum anderen,./data/resized_val_set/2647394564.jpg,2647394564
242,ein kleines kind beim schlagen mit einem plastikbaseballschläger,./data/resized_val_set/2648165716.jpg,2648165716
243,der mann telefoniert vor roter leuchtreklame,./data/resized_val_set/264928854.jpg,264928854
244,frauen und ein junge beim gespräch in einem zimmer,./data/resized_val_set/2654018684.jpg,2654018684
245,junge frau spielt oboe,./data/resized_val_set/2669048370.jpg,2669048370
246,trubel in einer chinesischen einkaufsstraße,./data/resized_val_set/26758039.jpg,26758039
247,ein mann sitzt am ufer eines bachs,./data/resized_val_set/2676015068.jpg,2676015068
248,das sind zwei menschen die etwas an einem baum befestigen,./data/resized_val_set/268044066.jpg,268044066
249,vier schwarz gekleidete menschen gehen die straße entlang,./data/resized_val_set/269361490.jpg,269361490
250,mehrere gäste machen sich startklar für die fahrt auf dem freefalltower,./data/resized_val_set/2705925058.jpg,2705925058
251,ein junger man mit nackten oberkörper vollführt stunts mit seinem skateboard,./data/resized_val_set/2712352554.jpg,2712352554
252,der mann baut eine große sandburg am strand,./data/resized_val_set/2723024306.jpg,2723024306
