,caption,image_file,image_id
0,a group of people stand in the back of a truck filled with cotton,./data/resized_val_set/1018148011.jpg,1018148011
1,an adult wearing a gray shirt with red sleeves sleeping on a couch,./data/resized_val_set/1029450589.jpg,1029450589
2,boy in brown shirt with headphones on sits on woman shoulders in a crowd,./data/resized_val_set/1029737941.jpg,1029737941
3,two men standing on an ice looking into something covered with a blue tarp,./data/resized_val_set/103205630.jpg,103205630
4,a man in a green shirt and red life jacket is sitting in a canoe drifting around the lake,./data/resized_val_set/10350842.jpg,10350842
5,a woman in jeans and a red coat and carrying a multicolored handbag spreads put her arms while leaping up from a cobblestone street,./data/resized_val_set/1054620089.jpg,1054620089
6,two dogs run towards each other on a rocky area with water in the background,./data/resized_val_set/1056873310.jpg,1056873310
7,a young helmeted man in his team uniform is swinging his bat at an incoming baseball,./data/resized_val_set/1072439304.jpg,1072439304
8,a guy sitting at a desk talking on a phone with books laying everywhere,./data/resized_val_set/1073444492.jpg,1073444492
9,woman is enjoying herself being outdoors biking in a forrest preserve,./data/resized_val_set/1092437557.jpg,1092437557
10,a boy wearing blue and yellow walking on a cliff edge,./data/resized_val_set/109671650.jpg,109671650
11,a snowmobile rider flies through the air on his or her machine in front of tall pine trees,./data/resized_val_set/109738763.jpg,109738763
12,a mother and three children collecting garbage from a blue and white garbage can on the street,./data/resized_val_set/109982467.jpg,109982467
13,a darkhaired woman in a green and white apron sits amid her outdoor display of flowers for sale on a city street,./data/resized_val_set/110269384.jpg,110269384
14,there is a woman and man wearing orange shirts playing instruments with sheet paper in front of them,./data/resized_val_set/1107507919.jpg,1107507919
15,people on atvs and dirt bikes are traveling along a worn path in a field surrounded by trees,./data/resized_val_set/112243673.jpg,112243673
16,an older man sits back and relaxes on a patio outside an adobe building where many bicycles are propped,./data/resized_val_set/1124448967.jpg,1124448967
17,a group of people are standing outside at a carnival near a ride called the green jungle,./data/resized_val_set/1126137905.jpg,1126137905
18,a young girl sitting on a small chair surrounded by what looks like handmade fabrics and bags,./data/resized_val_set/1128874064.jpg,1128874064
19,there are three young people one darkhaired holding a bottled drink one with head tilted back and finger in her mouth and one with spiked hair,./data/resized_val_set/1130017585.jpg,1130017585
20,a group of people gather in a bar and one man in a black shirt holds his arm and signals to the camera,./data/resized_val_set/1141643526.jpg,1141643526
21,woman and man walking across wooden rope bridge with a caution sign beside it,./data/resized_val_set/1141718391.jpg,1141718391
22,a man in a gray cap a pink tank top and short skirt pinkandblack striped socks and boots juggles knives in front of a brick building whose sign reads the pump room while onlookers watch,./data/resized_val_set/1150429218.jpg,1150429218
23,woman dressed in a green hat and apron is holding a tray full of drink samples,./data/resized_val_set/1155138244.jpg,1155138244
24,construction workers standing on top of a piece of machinery,./data/resized_val_set/116569042.jpg,116569042
25,two dogs are playing rough in a green field of grass,./data/resized_val_set/1206506157.jpg,1206506157
26,a baby on the floor laughing at an older another child,./data/resized_val_set/120764850.jpg,120764850
27,three men in coldweather styled clothing walking down a road,./data/resized_val_set/121556607.jpg,121556607
28,someone parasailing with a green parachute that has a face on the top of it,./data/resized_val_set/1215804065.jpg,1215804065
29,a constructions site on the side of the mountain with a bulldozer digging in the ground that is all dirt,./data/resized_val_set/123244147.jpg,123244147
30,a young girl in dark shorts and a blue tank top runs on the grass near an orange cone and tape,./data/resized_val_set/1235099089.jpg,1235099089
31,a red liquids travels down a grate as it leaks across a street,./data/resized_val_set/123866385.jpg,123866385
32,a young boy wearing a white shirt is dangling from the monkey bars,./data/resized_val_set/126042604.jpg,126042604
33,a tall gray pole behind which a person wearing an orange shirt is perched on the wall and hiding his or her face with one hand,./data/resized_val_set/1277949368.jpg,1277949368
34,a kid is pulling a man trying to get him to do something in front of a crowd of people,./data/resized_val_set/128452798.jpg,128452798
35,there a several people in a dark bartype room including one girl on a stool,./data/resized_val_set/1296770308.jpg,1296770308
36,pedestrians walk through an open area between several traditionalstyle japanese or chinese buildings,./data/resized_val_set/1306755031.jpg,1306755031
37,a man holding a blue backpack reading the paper and a woman wearing a black coat wait for their train,./data/resized_val_set/1335877186.jpg,1335877186
38,brown dog on grass drinking water spray from left side of frame,./data/resized_val_set/1341787777.jpg,1341787777
39,a blond boy in a blue tshirt stands smiling before a craft of green nylon fabric,./data/resized_val_set/1343426964.jpg,1343426964
40,here is a little boy whose being very cooperative and sweeping the outside porch area with a large broom on the front porch that has a strong railing,./data/resized_val_set/134642833.jpg,134642833
41,a person about in the middle of throwing a green bowling ball down a bowling lane,./data/resized_val_set/1348517311.jpg,1348517311
42,a man is on stage singing and three people are playing guitars in front of a crowd,./data/resized_val_set/134857559.jpg,134857559
43,an old man holding a camera while walking a small brown dog,./data/resized_val_set/1348947380.jpg,1348947380
44,a red race car marked with the number seven is driven by a man in a blue and beige shirt,./data/resized_val_set/1355945307.jpg,1355945307
45,a group of children that are either sitting or standing in a line while two are holding a round object,./data/resized_val_set/135608578.jpg,135608578
46,a young child is throwing a big rock into a body of water,./data/resized_val_set/1358398144.jpg,1358398144
47,a blond woman is in her kitchen holding a knife and graham crackers as she is making pie with cranberries and cherries,./data/resized_val_set/135980645.jpg,135980645
48,two people are wearing a chinese dragon costume in front of an ornate chinese gazebo with red pillars and the gazebo has two large red lanterns hanging from the roof,./data/resized_val_set/1361790462.jpg,1361790462
49,a dog walking through a stream carrying a white towel in its mouth,./data/resized_val_set/1363843090.jpg,1363843090
50,three small dogs two white and one black and white on a sidewalk,./data/resized_val_set/1368338041.jpg,1368338041
51,a large man sits in the back of a canoe with another man in front on a river,./data/resized_val_set/136886677.jpg,136886677
52,two girls facing each other one has a skull face bag wearing a red and black shirt the other is wearing a beaded belt,./data/resized_val_set/1389264266.jpg,1389264266
53,a group of four girls are in the back of a vehicle looking at a book with a pink cover,./data/resized_val_set/1393205795.jpg,1393205795
54,people on the beach look up to the sky to see a large heart written in the air by the contrail of a plane,./data/resized_val_set/1394319096.jpg,1394319096
55,a woman in a white jacket and pink shorts is sitting down reading a book with her head resting on her right hand,./data/resized_val_set/1405665934.jpg,1405665934
56,a man with dark hair is wearing a white shirt with printed flames and is holding a pair of tongs,./data/resized_val_set/1409723496.jpg,1409723496
57,a man in a blue shirt and brown sports coat adjusts something in his hand,./data/resized_val_set/1410039760.jpg,1410039760
58,guy in black wetsuit is riding a wave with a white surfboard,./data/resized_val_set/141126420.jpg,141126420
59,an asian woman sitting on a bench going through a pink laptop bag,./data/resized_val_set/141186473.jpg,141186473
60,woman wearing a striped blouse sits among other women,./data/resized_val_set/1432734769.jpg,1432734769
61,a red plne is flying by the queen elisabeth shooting out red smoke,./data/resized_val_set/1436832881.jpg,1436832881
62,a man in a white shirt and helmet is using climbing equipment,./data/resized_val_set/143688283.jpg,143688283
63,a man in an orange shirt and white hard hat stands in front of an orange construction vehicle as it dumps dirt into a truck,./data/resized_val_set/143793054.jpg,143793054
64,truck filled with gallons bottles in the back and a man on top looking at them,./data/resized_val_set/1438769690.jpg,1438769690
65,a woman wearing a white hat white top and orange skirt is jumping in front of some trees,./data/resized_val_set/144328407.jpg,144328407
66,in the middle of a shopping center there is a man who is painted gold with a gold bicycle,./data/resized_val_set/1463864223.jpg,1463864223
67,a baby in a pink sweater looks up at a leafy branch,./data/resized_val_set/146758244.jpg,146758244
68,two workers at a train station are cleaning an elevator,./data/resized_val_set/14868339.jpg,14868339
69,two barefoot young african boys in brightly colored clothing are sitting on a stone floor one holding a clear bottle of water with a second blue bottle on the floor between his legs,./data/resized_val_set/149042906.jpg,149042906
70,many people out enjoying themselves and admiring parked motorcycles at an outdoor event,./data/resized_val_set/149231190.jpg,149231190
71,a person in a red and black jacket with a black backpack scales a mountain face,./data/resized_val_set/1496289999.jpg,1496289999
72,a darkhaired woman wearing a brown jacket and fatigue bottoms and a balding man wearing a green sweater and blue jeans with a fishing pole stand at the foot of the surf,./data/resized_val_set/1499495021.jpg,1499495021
73,a girl is doing a trick on a blue trampoline and is in the air,./data/resized_val_set/1507563902.jpg,1507563902
74,children are riding a swing ride at an amusement park or state fair,./data/resized_val_set/155014252.jpg,155014252
75,two people are holding a large upsidedown earth globe about in diameter and a child appears to be jumping over antarctica,./data/resized_val_set/1554086730.jpg,1554086730
76,one man wearing camouflage pants and green tshirt stands with one foot on a square while another man wearing the same type of clothing reaches out with a baseball glove on his left hand,./data/resized_val_set/156249400.jpg,156249400
77,this is a scene of several people walking outside during the day including a woman with two coffee urns,./data/resized_val_set/1567005236.jpg,1567005236
78,a police officer on a motorcycle is behind a four door sedan on a road with billboards in the distance,./data/resized_val_set/1581304802.jpg,1581304802
79,a person stands beside a boat on a dock looking out across a lake that reflect trees in the distance,./data/resized_val_set/1588931550.jpg,1588931550
80,a field with some scottish marching bands and many spectators sitting on the stadium behind,./data/resized_val_set/162839055.jpg,162839055
81,woman in a leopard print outfit walking in the street and a man in a dark blue jacket and denim jeans walking in the opposite direction,./data/resized_val_set/166774567.jpg,166774567
82,a firefighter sprays water onto a gigantic pile or burning ash that includes flames and dark smoke,./data/resized_val_set/167001809.jpg,167001809
83,a person with a purple shirt is painting an image of a woman on a white wall,./data/resized_val_set/1680409989.jpg,1680409989
84,two little girls are playing in their house one is on the floor grinning evilly wearing pink pajamas and the younger one is standing over her wearing a hairnet and mask and purple pajamas,./data/resized_val_set/1680674943.jpg,1680674943
85,a young woman and older woman wear traditional saris as they spin textiles three people are pictured at only the waists and wear modern clothes,./data/resized_val_set/1717077532.jpg,1717077532
86,person dressed in heavy winter clothes with cap on walking in some deep snow,./data/resized_val_set/172892648.jpg,172892648
87,a man wearing a uniform is standing just inside the back of a delivery truck while two other men are standing on the ground near the truck,./data/resized_val_set/1732567333.jpg,1732567333
88,stretched image of a brown dog with a white patch of fur in his chest area sitting in the grass with trees in the background,./data/resized_val_set/1745110280.jpg,1745110280
89,a brown and white dog exiting a yellow and blue ramp in a grassy area,./data/resized_val_set/1752454466.jpg,1752454466
90,a little boy sitting on the wood floor with a book on his table,./data/resized_val_set/175369436.jpg,175369436
91,an asian man wearing a blue longsleeve shirt and patterned pants is working with an old looking machine,./data/resized_val_set/1791491934.jpg,1791491934
92,an adult and a child both wearing hats are outside looking at a black and white rooster in a cage,./data/resized_val_set/180217379.jpg,180217379
93,a young child in a costume rings the door bell of a gray house,./data/resized_val_set/1814391289.jpg,1814391289
94,man dressed up in black and brown and holding a white light saber,./data/resized_val_set/1836335410.jpg,1836335410
95,a woman with black hair wearing a black and white polkadot dress is singing into a microphone,./data/resized_val_set/1837976956.jpg,1837976956
96,two women sit on the beach in holes seem to be digging for something with rocks and sand all around them,./data/resized_val_set/1877161207.jpg,1877161207
97,several people lay out in the sun on white lawn chairs by a body of water,./data/resized_val_set/190965502.jpg,190965502
98,six men seat in a wooden boat while two are the background surrounded by logs and a green landscape,./data/resized_val_set/194197375.jpg,194197375
99,a young boy carrying a big black plastic bag over his shoulder crossing a dirt road,./data/resized_val_set/1944813674.jpg,1944813674
100,a large bearded man flips a crepe or omelet in midair with his frying pan,./data/resized_val_set/2043372516.jpg,2043372516
101,a man in a yellow suit is kneeling on top of a piano while another man in yellow has a musical instrument in his hands,./data/resized_val_set/205675005.jpg,205675005
102,the setting sun outlines a group of four people and the surrounding trees,./data/resized_val_set/2064780645.jpg,2064780645
103,a black and brown dog is biting on a stick in the forest,./data/resized_val_set/2066241589.jpg,2066241589
104,a man in camouflage hiking gear wearing a green pouch is standing in the foothills,./data/resized_val_set/2067833088.jpg,2067833088
105,man in white shirt flipping young boy in the water with four other boys surrounding them,./data/resized_val_set/2068403258.jpg,2068403258
106,a woman in a white halter top and a man wearing a white shirt and holding blue cotton candy are both smiling,./data/resized_val_set/207015505.jpg,207015505
107,two children raise their hands to ask a question to the two women at the front of their classroom,./data/resized_val_set/2078709661.jpg,2078709661
108,two women stand in the front of an elementary classroom while little children are setting in front of them,./data/resized_val_set/2079499010.jpg,2079499010
109,a person wearing a hat and scarf looks to the right,./data/resized_val_set/2081446176.jpg,2081446176
110,a woman in a blue winter coat and a person in a black winter vest are crossing the street when the do nt walk sign is lit,./data/resized_val_set/2082620071.jpg,2082620071
111,an elderly gentleman sits on a couch while holding a small dog as another small dog investigates the situation,./data/resized_val_set/2082663150.jpg,2082663150
112,three little girls look on as a boy plays the harmonica with an adult guiutarist sitting beside him,./data/resized_val_set/2095478050.jpg,2095478050
113,a boy wearing a yellow jersey is accepting the baton from a female wearing a yellow jersey in a relay race,./data/resized_val_set/2102902012.jpg,2102902012
114,the car sinks up to the tops of its wheels in the mud,./data/resized_val_set/210625425.jpg,210625425
115,a woman in a gray hat is aiming her camera in the snow as to take a picture,./data/resized_val_set/2109370875.jpg,2109370875
116,man in shorts sitting on a tile floor near a window while other people sit or stand nearby,./data/resized_val_set/2112114341.jpg,2112114341
117,a dog treads through a shallow area of water located on a rocky mountainside,./data/resized_val_set/2112661738.jpg,2112661738
118,a woman in the middle of a grassy field during autumn jumps in the air and extends her arms over her head,./data/resized_val_set/2113592981.jpg,2113592981
119,two men are playing guitars and one man is singing into a microphone on a stage with the spotlight on them,./data/resized_val_set/21167868.jpg,21167868
120,young protesters standing on a street corner standing against exploitation of young people rights,./data/resized_val_set/212155635.jpg,212155635
121,a man grilling meats and mushrooms on a grill,./data/resized_val_set/2123858003.jpg,2123858003
122,a man is walking a dog with a pink lacy collar while enjoying a beer with a friend,./data/resized_val_set/212536960.jpg,212536960
123,children at daycare playing on rings and poles one parent standing and holding her child and one teacher is sitting on the bench watching the others play,./data/resized_val_set/212857743.jpg,212857743
124,a little girl wearing a red shirt is sitting at the table in front of a fruit plate,./data/resized_val_set/213269168.jpg,213269168
125,three people one tall male in blue polo shirt and khaki shorts with tan shoes brunette heavy chested female in white summer blouse and denim shorts second female wearing yellow rimmed sunglasses yellow blouse and sandals walking across a city street,./data/resized_val_set/213609234.jpg,213609234
126,a black poodle jumping on the head of a white poodle while walking in the snow,./data/resized_val_set/2148916767.jpg,2148916767
127,a girl with redhair and a spiderman suit on is sitting on a toy horse while holding her arms up and her mouth open,./data/resized_val_set/2159447283.jpg,2159447283
128,a man sits in a rowboat alone on foggy water,./data/resized_val_set/217583047.jpg,217583047
129,skiiers are walking through the snow near the mountains,./data/resized_val_set/2187904131.jpg,2187904131
130,a woman and two gentlemen are taking a stroll along the beach as the woman talks on her cellphone one of the men takes her picture,./data/resized_val_set/2190899457.jpg,2190899457
131,many children are playing and swimming in the water,./data/resized_val_set/2192026581.jpg,2192026581
132,female beach volleyball players on either side of a net with one looking to spike the ball as her teammate watches with the blue sky in the background,./data/resized_val_set/2206282062.jpg,2206282062
133,a man and woman sit across from each other at a restaurant table,./data/resized_val_set/2206600240.jpg,2206600240
134,a boy is kissing a woman on the cheek next to a girl who is wide eyed and sticking out her tongue,./data/resized_val_set/2208310655.jpg,2208310655
135,a golden labrador is swimming through water with a red toy in its mouth,./data/resized_val_set/2209496328.jpg,2209496328
136,men standing around a car with a lamp behind them,./data/resized_val_set/2209751.jpg,2209751
137,a group of five children and three adults look on while a fourth adult speaks on a beach,./data/resized_val_set/2210054257.jpg,2210054257
138,a baby in campflauge crawls on a clean hardwood floor,./data/resized_val_set/2212472643.jpg,2212472643
139,a little girl donates to the salvation army near a storefront with white plastic containers,./data/resized_val_set/2214383094.jpg,2214383094
140,the yellow dog walks on the beach with a tennis ball in its mouth,./data/resized_val_set/2219805467.jpg,2219805467
141,a man in a red muscle shirt poses for a picture beside a stone building whilst other people pass by,./data/resized_val_set/2219959872.jpg,2219959872
142,a lady in a dark top and black necklace is sitting next to a man in a black sweater and listening to a conversation,./data/resized_val_set/2223151597.jpg,2223151597
143,a rock band performing on stage with a river in the background,./data/resized_val_set/2224524855.jpg,2224524855
144,two elderly women with gray hair engaging in conversation,./data/resized_val_set/2230971412.jpg,2230971412
145,a clothed female and male adults crocheting separately from a blue and orange yarn ball while sitting in chairs of wood,./data/resized_val_set/2250479700.jpg,2250479700
146,a person in a red jacket on top of rocks,./data/resized_val_set/2251418114.jpg,2251418114
147,a man sitting on a chair with a beer in his hands roasting something to eat on a wooden stick,./data/resized_val_set/226115048.jpg,226115048
148,a policeman wearing a black had and a bright green shirt licks his lips,./data/resized_val_set/227689211.jpg,227689211
149,a man in what looks like a firefighter suit standing in the street with a large vehicles in the street,./data/resized_val_set/2279729059.jpg,2279729059
150,a black dog with white facial and chest markings standing in chest high water,./data/resized_val_set/2280354512.jpg,2280354512
151,a man sings while surrounding band members play instruments such as the keyboards and the drums while other instruments are unused in the background,./data/resized_val_set/2281226546.jpg,2281226546
152,a woman in a long black dress playing the violin with a black man in a striped shirt while the other band member with guitar plays along,./data/resized_val_set/2289754578.jpg,2289754578
153,a man playing a keyboard and singing into a microphone,./data/resized_val_set/2295489839.jpg,2295489839
154,a kid in a yellow jacket and blue baseball cap jumping from a rock,./data/resized_val_set/2297744130.jpg,2297744130
155,a girls sitting pretty on the arm of a couch rads a card presented to her by a girl that standing sideways with a glass of wine in her hands,./data/resized_val_set/230105501.jpg,230105501
156,construction workers wearing yellow vests and blue hats are outside working,./data/resized_val_set/2310452540.jpg,2310452540
157,a man with a shaved head is sitting on a sandy beach holding an electric razor close to his face,./data/resized_val_set/2311881432.jpg,2311881432
158,a woman wearing a blue shirt opens a present which is a green hat,./data/resized_val_set/2315320158.jpg,2315320158
159,there are two men and a woman in church the woman is in the back and the men are next to a piano,./data/resized_val_set/2319963351.jpg,2319963351
160,a man wearing a facebook lanyard is holding a microphone,./data/resized_val_set/2324842075.jpg,2324842075
161,a hotel bellboy is pushing a gold colored metal luggage cart filled with various pieces of luggage outside of a fancy hotel,./data/resized_val_set/2326795765.jpg,2326795765
162,a black and brown dog staring off into the distance at something,./data/resized_val_set/233361142.jpg,233361142
163,a man in a striped shirt and lady in a black hat are watching a young band perform on stage,./data/resized_val_set/2334983049.jpg,2334983049
164,three dogs come face to face with each other in a snowy field,./data/resized_val_set/2340206885.jpg,2340206885
165,a woman in pigtails talks to the redhatted man under the shade of a tree,./data/resized_val_set/234580030.jpg,234580030
166,a dog plays with a ball with a large office building behind it,./data/resized_val_set/2353119813.jpg,2353119813
167,an older women wearing a red and gray printed sweater is standing in her kitchen stirring a stew,./data/resized_val_set/2354516058.jpg,2354516058
168,a young boy in a trench coat is holding a red bottle outside of a brick building,./data/resized_val_set/2359784186.jpg,2359784186
169,a woman carrying another woman wearing matching exercise attire on her back,./data/resized_val_set/2367317953.jpg,2367317953
170,a blond child holding a sword and dressed in a black robe is standing next to a stroller,./data/resized_val_set/2373370266.jpg,2373370266
171,a guy with afro hair gray sweater and jeans skating on a skating ramp high up on the side touching grass,./data/resized_val_set/2374523052.jpg,2374523052
172,a man dressed in black is carrying a table across a large empty looking hall,./data/resized_val_set/2376252671.jpg,2376252671
173,a man wearing a yellow shirt is steering a boat that has several other people on it,./data/resized_val_set/2382847674.jpg,2382847674
174,a man in a yellow shirt checks readings on a device outside of barnsdall art park,./data/resized_val_set/2383712490.jpg,2383712490
175,a woman with a dark blue shirt and jeans throws a bag of trash in a dumpster,./data/resized_val_set/2386635533.jpg,2386635533
176,a woman wears a red dress and a black mask while people dance behind her,./data/resized_val_set/2387197355.jpg,2387197355
177,a person parasails on the crest of a wave,./data/resized_val_set/2396025708.jpg,2396025708
178,men in similar blue and white jackets are on a bus with the same colors on the side,./data/resized_val_set/2398915100.jpg,2398915100
179,a four wheel drive car is driving through the mud,./data/resized_val_set/2409312675.jpg,2409312675
180,the american footballer wearing red is pushing the player in white to the ground,./data/resized_val_set/241345721.jpg,241345721
181,there is a football player in a red jersey on the field talking to his coach,./data/resized_val_set/241345811.jpg,241345811
