,caption,image_file,image_id
1064,two white dogs look at one black dog on a paved walkway,./data/resized_val_set/1368338041.jpg,1368338041
1065,two man are paddling a kayak along a river with green trees on either side,./data/resized_val_set/136886677.jpg,136886677
1066,a girl with pink streaked hair and fur uggs looks back while the girl walking next to her looks at her,./data/resized_val_set/1389264266.jpg,1389264266
1067,four young girls reading a book in the back of a car with boxes of produce,./data/resized_val_set/1393205795.jpg,1393205795
1068,as many gather on the beach to watch the air show the planes make a heart in the sky,./data/resized_val_set/1394319096.jpg,1394319096
1069,sitting casually in a public place a girl reads holding the book open with her hand on which is a butterfly ring,./data/resized_val_set/1405665934.jpg,1405665934
1070,a man in a colorful buttonup tshirt is pouring what appears to be barbecue sauce onto something,./data/resized_val_set/1409723496.jpg,1409723496
1071,an older man with glasses raises his eyebrows in surprise,./data/resized_val_set/1410039760.jpg,1410039760
1072,a man is surfing in a wetsuit and is coming out of the curl,./data/resized_val_set/141126420.jpg,141126420
1073,an asian woman poses on a bench with shopping bags,./data/resized_val_set/141186473.jpg,141186473
1074,four women sit looking at something beyond the camera,./data/resized_val_set/1432734769.jpg,1432734769
1075,a red plane flying over a boat as it trails pink smoke,./data/resized_val_set/1436832881.jpg,1436832881
1076,a man with a white shirt and helmet is climbing a mountain,./data/resized_val_set/143688283.jpg,143688283
1077,two construction workers assist in the loading of a dump truck at an urban construction site,./data/resized_val_set/143793054.jpg,143793054
1078,a woman in a colorful outfit is walking by a white truck filled with bottles,./data/resized_val_set/1438769690.jpg,1438769690
1079,woman dressed in sandals skirt and hat jumping in front of a blooming lilac bush,./data/resized_val_set/144328407.jpg,144328407
1080,a man dressed in gold with his gold bike stops to look at the city,./data/resized_val_set/1463864223.jpg,1463864223
1081,a baby looking up at a leafy branch above her head,./data/resized_val_set/146758244.jpg,146758244
1082,a custodian is talking to another man by an elevator,./data/resized_val_set/14868339.jpg,14868339
1083,two small brightly dressed african children with water bottles are sitting on a stone floor,./data/resized_val_set/149042906.jpg,149042906
1084,green traffic signals light up as people look at motorcycles,./data/resized_val_set/149231190.jpg,149231190
1085,a adventure bound person climbing the face of a mountain,./data/resized_val_set/1496289999.jpg,1496289999
1086,a man and a woman are standing on a shore while the man fishes in the choppy water,./data/resized_val_set/1499495021.jpg,1499495021
1087,a person is upside down in the air above a trampoline outside,./data/resized_val_set/1507563902.jpg,1507563902
1088,children enjoying themselves on an amusement park ride,./data/resized_val_set/155014252.jpg,155014252
1089,three boys are playing outside and two are holding a giant ball that looks like a globe while the other jumps up high over it,./data/resized_val_set/1554086730.jpg,1554086730
1090,men in army fatigues playing baseball in the middle of a dirt field in the middle of the day,./data/resized_val_set/156249400.jpg,156249400
1091,a woman in a black dress is pushing a cart with thermos down a paved walkway,./data/resized_val_set/1567005236.jpg,1567005236
1092,a policeman on a motorcycle is stopped behind a car he pulled over,./data/resized_val_set/1581304802.jpg,1581304802
1093,man standing on a pier next to a boat on a still lake,./data/resized_val_set/1588931550.jpg,1588931550
1094,a large group of men in military garb standing on a field with a crowd behind them,./data/resized_val_set/162839055.jpg,162839055
1095,a woman and a child sit together in a door frame along a gray sidewalk as a man and two women walk past,./data/resized_val_set/166774567.jpg,166774567
1096,a firefighter spraying water on the flames of a large fire,./data/resized_val_set/167001809.jpg,167001809
1097,a lady in a purple shirt is painting a picture of a person on a curved wall,./data/resized_val_set/1680409989.jpg,1680409989
1098,a little girl is laying down on her back on a hardwood floor looking out of the corner of her eyes at a smaller child who is wearing pajamas a hairnet and a surgical mask,./data/resized_val_set/1680674943.jpg,1680674943
1099,in a public area a young girl in a pink dress sits next to an older woman who works a primitive device to make brown thread,./data/resized_val_set/1717077532.jpg,1717077532
1100,woman wearing black snow pants and jacket walking down a snowy hill,./data/resized_val_set/172892648.jpg,172892648
1101,the fedex driver listens to the workman in the green hard hat while the equipment to ship is being loaded,./data/resized_val_set/1732567333.jpg,1732567333
1102,a caramel colored dog sits in front of trees looking forward,./data/resized_val_set/1745110280.jpg,1745110280
1103,a brown a white dog runs down a yellow and blue ramp,./data/resized_val_set/1752454466.jpg,1752454466
1104,a young boy with a book sits on the floor in front of a table,./data/resized_val_set/175369436.jpg,175369436
1105,a older japanese man trying to fix a small red and gray machine,./data/resized_val_set/1791491934.jpg,1791491934
1106,a woman is watching her child who is in front of a chicken inside a cage,./data/resized_val_set/180217379.jpg,180217379
1107,a child that is dressed as spiderman is ringing the doorbell,./data/resized_val_set/1814391289.jpg,1814391289
1108,a man wearing a black outfit holding on to a glowing sword,./data/resized_val_set/1836335410.jpg,1836335410
1109,a young woman stands singing at a microphone while a man behind her holds a guitar,./data/resized_val_set/1837976956.jpg,1837976956
1110,two women are sitting in ditches of dirt with two buckets and a purse close by,./data/resized_val_set/1877161207.jpg,1877161207
1111,many of the chairs are empty with only a few people enjoying the sun,./data/resized_val_set/190965502.jpg,190965502
1112,a group of fishermen on a boat tied up in a bay with piles of driftwood near them,./data/resized_val_set/194197375.jpg,194197375
1113,a young man is carrying something in a large black plastic garbage bag,./data/resized_val_set/1944813674.jpg,1944813674
1114,an older overweight man flips a pancake while making breakfast,./data/resized_val_set/2043372516.jpg,2043372516
1115,men wearing yellow suits are on stage with a piano and one man is playing an upright bass,./data/resized_val_set/205675005.jpg,205675005
1116,a group of people standing in front of a setting sun,./data/resized_val_set/2064780645.jpg,2064780645
1117,a brown dog chewing on a large piece of wood,./data/resized_val_set/2066241589.jpg,2066241589
1118,a person in hiking gear is standing on a hill with a mountain in the background,./data/resized_val_set/2067833088.jpg,2067833088
1119,an airborne kid is watched by his launcher and others,./data/resized_val_set/2068403258.jpg,2068403258
1120,a young man in a white shirt holding cotton candy next to a young woman in a white tank top,./data/resized_val_set/207015505.jpg,207015505
1121,two women are standing in front of a class of children talking about a book,./data/resized_val_set/2078709661.jpg,2078709661
1122,two ladies in jeans stood in front of three young children with fair hair,./data/resized_val_set/2079499010.jpg,2079499010
1123,a man wearing a scarf and knitted hat is smiling,./data/resized_val_set/2081446176.jpg,2081446176
1124,two people are crossing the street even though the sign says they should not be,./data/resized_val_set/2082620071.jpg,2082620071
1125,elderly man poses with his two dogs while sitting on his living room couch,./data/resized_val_set/2082663150.jpg,2082663150
1126,a man is playing a guitar with a child playing a harmonica while three young girls watch,./data/resized_val_set/2095478050.jpg,2095478050
1127,a boy who is taking a stick from a girl in the middle of a race,./data/resized_val_set/2102902012.jpg,2102902012
1128,a four wheel drive car is driving through the mud,./data/resized_val_set/210625425.jpg,210625425
1129,the lady wearing a black hat is taking a picture while the snowfalls,./data/resized_val_set/2109370875.jpg,2109370875
1130,a young man in a green tshirt strums his guitar while sitting crosslegged on the floor,./data/resized_val_set/2112114341.jpg,2112114341
1131,a dog is standing in a small pool of water on top of a mountain,./data/resized_val_set/2112661738.jpg,2112661738
1132,an asian woman is jumping in celebration in a park outside the city,./data/resized_val_set/2113592981.jpg,2113592981
1133,a three man band is performing on stage,./data/resized_val_set/21167868.jpg,21167868
1134,three young men and young lady are protesting about the exploitation of young workers,./data/resized_val_set/212155635.jpg,212155635
1135,a man cooking burgers on a black grill,./data/resized_val_set/2123858003.jpg,2123858003
1136,two men standing on a sidewalk with a tiny dog with a pink lacy collar on,./data/resized_val_set/212536960.jpg,212536960
1137,a young boy in yellow tshirt hanging from a ring with other kids around,./data/resized_val_set/212857743.jpg,212857743
1138,a child sits smiling in front of a plate of watermelon and strawberries,./data/resized_val_set/213269168.jpg,213269168
1139,one man and two women wearing shorts walk down the street,./data/resized_val_set/213609234.jpg,213609234
1140,black dog jumping over a white dog in a snowy path,./data/resized_val_set/2148916767.jpg,2148916767
1141,a young redheaded girl wearing a spiderman costume is riding a hobby horse,./data/resized_val_set/2159447283.jpg,2159447283
1142,a man in a white boat is rowing through fog,./data/resized_val_set/217583047.jpg,217583047
1143,the skiers are in front of the lodge,./data/resized_val_set/2187904131.jpg,2187904131
1144,a group of people are in a dirt mount one person is talking on the one one is taking a picture and one is jumping in the air,./data/resized_val_set/2190899457.jpg,2190899457
1145,a group of youngsters swim in lake water,./data/resized_val_set/2192026581.jpg,2192026581
1146,women are playing beach volleyball with one about to spike one about to block and the other looking on,./data/resized_val_set/2206282062.jpg,2206282062
1147,a young man and an older woman sitting together in a restaurant,./data/resized_val_set/2206600240.jpg,2206600240
1148,an adult with two kids one child making a face and the other kissing the adult cheek,./data/resized_val_set/2208310655.jpg,2208310655
1149,a white dog swims in the water while holding a red object in its mouth,./data/resized_val_set/2209496328.jpg,2209496328
1150,a movie with a car is being filmed on the street,./data/resized_val_set/2209751.jpg,2209751
1151,a group of men women and children all wearing hats talk on the beach,./data/resized_val_set/2210054257.jpg,2210054257
1152,a small boy wearing pajamas crawls across the floor,./data/resized_val_set/2212472643.jpg,2212472643
1153,a woman in a black and white salvation army uniform accepts a donation from a young girl,./data/resized_val_set/2214383094.jpg,2214383094
1154,a brown dog on the beach with a yellow ball in his mouth,./data/resized_val_set/2219805467.jpg,2219805467
1155,a man wearing a sleeveless shirt and sunglasses standing next to two children,./data/resized_val_set/2219959872.jpg,2219959872
1156,a man and woman seated at a table converse while another couple standing at the bar behind them does the same,./data/resized_val_set/2223151597.jpg,2223151597
1157,a band playing in an outdoor theater along the river,./data/resized_val_set/2224524855.jpg,2224524855
1158,the two old grandmother is talking each other,./data/resized_val_set/2230971412.jpg,2230971412
1159,a woman wearing a pink shirt showing a man with a striped sweater how to do some work with yarn,./data/resized_val_set/2250479700.jpg,2250479700
1160,a little boy sitts on top of a big rock,./data/resized_val_set/2251418114.jpg,2251418114
1161,a man having a beer and roasting a hotdog the old fashioned way on a stick over a fire pit,./data/resized_val_set/226115048.jpg,226115048
1162,a police officer standing next to a crowd of people in sailor suits,./data/resized_val_set/227689211.jpg,227689211
1163,a man in an orange jacket and pants standing in the street looking at a orange truck,./data/resized_val_set/2279729059.jpg,2279729059
1164,a black and white dog stands neck deep in clear water,./data/resized_val_set/2280354512.jpg,2280354512
1165,a band is playing music on stage at a concert,./data/resized_val_set/2281226546.jpg,2281226546
1166,a redhaired woman and a black man stand sharing a microphone while playing violins as part of an ensemble,./data/resized_val_set/2289754578.jpg,2289754578
1167,a young girl in a tank top is practicing keyboard,./data/resized_val_set/2295489839.jpg,2295489839
1168,a child wearing a yellow jacket is jumping down from a rock,./data/resized_val_set/2297744130.jpg,2297744130
1169,a woman is reading a card while sitting on an end of a couch while another woman is standing next to her holding a glass to drink,./data/resized_val_set/230105501.jpg,230105501
1170,five construction workers in hard hats and yellow vests are busy at work,./data/resized_val_set/2310452540.jpg,2310452540
1171,a bald headed man with a beard holding an electric shaver on a beach,./data/resized_val_set/2311881432.jpg,2311881432
1172,a blondhaired woman wearing a blue shirt unwraps a hat,./data/resized_val_set/2315320158.jpg,2315320158
1173,two men are behind an organ with very large organ pipes and one onlooker in the background,./data/resized_val_set/2319963351.jpg,2319963351
1174,a young blondhaired man speaks into a microphone,./data/resized_val_set/2324842075.jpg,2324842075
1175,a motel valet man wearing a trench coat pushing a load of luggage,./data/resized_val_set/2326795765.jpg,2326795765
1176,the black and white dog is running through the bushes,./data/resized_val_set/233361142.jpg,233361142
1177,a group is playing music on stage in front of a crowd of people,./data/resized_val_set/2334983049.jpg,2334983049
1178,a group of dogs look at each other while standing in the snow,./data/resized_val_set/2340206885.jpg,2340206885
1179,a man and a woman talk while standing next to a tree,./data/resized_val_set/234580030.jpg,234580030
1180,a dog is jumping playing with a ball that has broken,./data/resized_val_set/2353119813.jpg,2353119813
1181,an older woman in a sweater stirs a pot of food in the kitchen,./data/resized_val_set/2354516058.jpg,2354516058
1182,a man in a long gray overcoat stands in a courtyard as snowfalls,./data/resized_val_set/2359784186.jpg,2359784186
1183,there is a girl in a puma jacket being hugged from behind by another girl,./data/resized_val_set/2367317953.jpg,2367317953
1184,a little boy in a samurai costume holds a toy sword as he stands in front of a stroller,./data/resized_val_set/2373370266.jpg,2373370266
1185,a guy with curly hair is skateboarding along a gray ramp with yellow letters,./data/resized_val_set/2374523052.jpg,2374523052
1186,a man wearing black is moving a table top in an empty room,./data/resized_val_set/2376252671.jpg,2376252671
1187,a group of young people are riding a speedboat on the water,./data/resized_val_set/2382847674.jpg,2382847674
1188,a man in a yellow shirt stands in front of a gray concrete building,./data/resized_val_set/2383712490.jpg,2383712490
1189,a woman in a blue shirt and jeans is throwing something away in a dumpster,./data/resized_val_set/2386635533.jpg,2386635533
1190,a woman in a red dress and black mask is on a crowded dance floor,./data/resized_val_set/2387197355.jpg,2387197355
1191,a windsurfer in the waves of the ocean,./data/resized_val_set/2396025708.jpg,2396025708
1192,a group of chinese people on a bus wearing matching clothing,./data/resized_val_set/2398915100.jpg,2398915100
1193,a monster truck gets stuck in a muddy hole,./data/resized_val_set/2409312675.jpg,2409312675
1194,one football player in a red jersey jumping onto a player wearing a white jersey,./data/resized_val_set/241345721.jpg,241345721
1195,coach talks with football player other players and crowd in background,./data/resized_val_set/241345811.jpg,241345811
1196,two young blond girls in red and white ball uniforms with people behind them,./data/resized_val_set/241347580.jpg,241347580
1197,a man in a white shirt is walking on a football field in front of some players,./data/resized_val_set/241347611.jpg,241347611
1198,a man in a red football uniform and helmet looks to the left,./data/resized_val_set/241347803.jpg,241347803
1199,a boy in black clothes is doing a cartwheel on the beach,./data/resized_val_set/2417341107.jpg,2417341107
1200,a group of people stand on a brick path,./data/resized_val_set/2417623030.jpg,2417623030
1201,a man in a green shirt is kissing a crying toddler whilst watching runners in a road race,./data/resized_val_set/2420730259.jpg,2420730259
1202,five men are playing musical instruments together on a stage,./data/resized_val_set/2430018178.jpg,2430018178
1203,three women are sitting on a blanket on the ground with a baby and are talking and having a good time,./data/resized_val_set/2434710077.jpg,2434710077
1204,a man and a boy adorned in red and gold ring bells during some type of ceremony,./data/resized_val_set/2439942035.jpg,2439942035
1205,a man in a black shirt is holding a child wearing sunglasses,./data/resized_val_set/2445654384.jpg,2445654384
1206,the gray dog is jumping through the grass with water in the background,./data/resized_val_set/2463067409.jpg,2463067409
1207,the girl with the long ponytail prepared to throw the ball to another player on the field,./data/resized_val_set/2473956981.jpg,2473956981
1208,this is an image of two men during a match of karate and a display of fighting skills,./data/resized_val_set/2474483208.jpg,2474483208
1209,a girl in a red and white shirt and blue shorts is getting ready to throw a ball,./data/resized_val_set/2474785004.jpg,2474785004
1210,a man sitting outside making something with some kind of tool,./data/resized_val_set/24759839.jpg,24759839
1211,a brown dog runs on the sand holding a stick,./data/resized_val_set/2479180530.jpg,2479180530
1212,a person canoeing on water with a black background,./data/resized_val_set/2481490320.jpg,2481490320
1213,a man in a red and white striped shirts sits on a stool at a hotdog stand,./data/resized_val_set/2488783398.jpg,2488783398
1214,a photographer eyes his next subject in a garden of tulips,./data/resized_val_set/2490365757.jpg,2490365757
1215,two men in fez have a discussion in an outdoor market,./data/resized_val_set/2493782805.jpg,2493782805
1216,a man and a boy are outside playing with a dog in the evening,./data/resized_val_set/2494088238.jpg,2494088238
1217,a hot air balloon touching down with a man shadow in the background,./data/resized_val_set/2500785647.jpg,2500785647
1218,a man wearing a red gray and blue shirt and a hat,./data/resized_val_set/2502975562.jpg,2502975562
1219,a woman wearing a coat having her face painted with metallic face paint,./data/resized_val_set/2504683345.jpg,2504683345
1220,the mother and her child loves to play at the park,./data/resized_val_set/2506113060.jpg,2506113060
1221,a crowd of people stand in street in front of a series of white tents,./data/resized_val_set/2508837436.jpg,2508837436
1222,lots of people are walking they participate in a parade,./data/resized_val_set/2508850304.jpg,2508850304
1223,a darkhaired woman wearing a blue blouse and sunglasses holds a banner while a young girl with braided hair writes on the banner,./data/resized_val_set/2511787709.jpg,2511787709
1224,two women and many children are walking single file down the street,./data/resized_val_set/2513060654.jpg,2513060654
1225,a cowboy wrangling a horse in a rodeo as the horse does a back kick,./data/resized_val_set/2521794926.jpg,2521794926
1226,a couple kissing at their wedding after saying i do,./data/resized_val_set/2526989006.jpg,2526989006
1227,two emergency response workers are putting blocks underneath a train,./data/resized_val_set/2536946133.jpg,2536946133
1228,man working on the railroad in a railroad station,./data/resized_val_set/2537601290.jpg,2537601290
1229,a man in a hard hat and orange safety vest stands near a wall holding a tray while a man in a blue hard hat watches,./data/resized_val_set/2537665596.jpg,2537665596
1230,a mariachi band plays a song on the sidewalk,./data/resized_val_set/2537801630.jpg,2537801630
1231,men in orange suits watching a machine dig near what looks to be subway tracks,./data/resized_val_set/2537817814.jpg,2537817814
1232,pedestrians walk on a sidewalk next to a grassy wooded field,./data/resized_val_set/2540751930.jpg,2540751930
1233,there is a chocolate brown dog running in water,./data/resized_val_set/2541104331.jpg,2541104331
1234,a man and a woman are walking in the middle of a street,./data/resized_val_set/2550027486.jpg,2550027486
1235,a man with a ski cap and neon yellow jacket looking down with a tree behind him,./data/resized_val_set/2563482243.jpg,2563482243
1236,two children wearing yellow rain jackets are playing in the mud,./data/resized_val_set/2565847129.jpg,2565847129
1237,there are multiple people going over a loop on an inverted roller coaster,./data/resized_val_set/2579268572.jpg,2579268572
1238,a mother and a child are interacting in a retrostyled room,./data/resized_val_set/2579699529.jpg,2579699529
1239,a group of people stand in a loose line on a brick ground,./data/resized_val_set/2580215443.jpg,2580215443
1240,a lady wearing a red and white polka dot swim cap is swimming in a pool,./data/resized_val_set/2592398210.jpg,2592398210
1241,a boy with an orange shirt smiles while a boy in a blue shirt looks on,./data/resized_val_set/2594042571.jpg,2594042571
1242,a little girl stands in a puddle on the concrete shrowded in darkness,./data/resized_val_set/2594459477.jpg,2594459477
1243,a small blond girl is holding a sandwich,./data/resized_val_set/2597088734.jpg,2597088734
1244,four people checking out and possibly repairing one of their bicycles,./data/resized_val_set/2600229816.jpg,2600229816
1245,a very wet brown dog is emerging from the water,./data/resized_val_set/2613209320.jpg,2613209320
1246,a little dog is bringing back a ball on an open grass field,./data/resized_val_set/2613993276.jpg,2613993276
1247,a group of people wait behind a barricade and look toward the right,./data/resized_val_set/2621771656.jpg,2621771656
1248,a child wearing a red sweatshirt is hanging upside down from a tree,./data/resized_val_set/262439544.jpg,262439544
1249,a carnival game operator takes the money of two willing contestants,./data/resized_val_set/2632429064.jpg,2632429064
1250,the young boy with brown hair is wearing a orange shirt with blue stripes has a great big smile,./data/resized_val_set/2636663855.jpg,2636663855
1251,two little kids without shirts are sitting down facing each other,./data/resized_val_set/2638054798.jpg,2638054798
1252,a man wearing a red jacket stands on the shore of a lake with a yellow kayak,./data/resized_val_set/2641770481.jpg,2641770481
1253,some people are walking through a tourist attraction,./data/resized_val_set/2644302353.jpg,2644302353
1254,a blond woman sits beside three other men and stares down at the counter,./data/resized_val_set/264461048.jpg,264461048
1255,a small blond child jumping from one bed to another,./data/resized_val_set/2647394564.jpg,2647394564
1256,a little boy in a winnie the pooh tshirt is waiting to swing his red bat,./data/resized_val_set/2648165716.jpg,2648165716
1257,the man is talking on his cellphone in front of a sports store,./data/resized_val_set/264928854.jpg,264928854
1258,two women are talking to a young boy while playing cards,./data/resized_val_set/2654018684.jpg,2654018684
1259,a woman in a blue shirt playing a wind instrument,./data/resized_val_set/2669048370.jpg,2669048370
1260,a city street crowded with pedestrians outside a building with illuminated blue words,./data/resized_val_set/26758039.jpg,26758039
1261,a man sitting in clear shallow water beside a large rock face,./data/resized_val_set/2676015068.jpg,2676015068
1262,a man and woman wearing backpacks are standing near a tall tree stump with a stone wall in the background,./data/resized_val_set/268044066.jpg,268044066
1263,four goth looking people walking down a street with trees in the background,./data/resized_val_set/269361490.jpg,269361490
1264,four people are strapped into some kind of amusement park ride,./data/resized_val_set/2705925058.jpg,2705925058
1265,a young man jumps in the air on a skateboard,./data/resized_val_set/2712352554.jpg,2712352554
1266,a man in a blue shirt is building a sand castle at the beach,./data/resized_val_set/2723024306.jpg,2723024306
1267,a black dog is chasing a smaller brown dog over grass,./data/resized_val_set/2723477522.jpg,2723477522
1268,multiple martial artist pose with their hands in the air,./data/resized_val_set/272354004.jpg,272354004
1269,a baseball player a woman with frisbees and a dog in front of blue bleachers,./data/resized_val_set/2734669176.jpg,2734669176
1270,a black dog standing in some grass holding a white plastic item in its mouth,./data/resized_val_set/274313927.jpg,274313927
1271,a boat with people and their belongings is in the water,./data/resized_val_set/2744330402.jpg,2744330402
1272,a cyclist donning blue and white is leading a pack of cyclists,./data/resized_val_set/2744600462.jpg,2744600462
1273,three people are sitting outside at a table with artwork leaning against it,./data/resized_val_set/275171617.jpg,275171617
1274,a man and woman walk on a sidewalk while the man puts his hand up to his mouth,./data/resized_val_set/275854404.jpg,275854404
