,caption,image_file,image_id
2105,a girl with blue hair is pushing a coffee cart,./data/resized_val_set/1567005236.jpg,1567005236
2106,a police officers on a motorcycle pulls up behind a silver sedan,./data/resized_val_set/1581304802.jpg,1581304802
2107,the man is looking out over a placid lake,./data/resized_val_set/1588931550.jpg,1588931550
2108,a celtic marching bands performs on field during a soccer match,./data/resized_val_set/162839055.jpg,162839055
2109,a man in a leather coat is walking down a brick sidewalk next to a woman wearing a colorful blue dress,./data/resized_val_set/166774567.jpg,166774567
2110,a firefighter sprays piles of burning debris with a hose,./data/resized_val_set/167001809.jpg,167001809
2111,a woman with a purple shirt painting another woman on a wall,./data/resized_val_set/1680409989.jpg,1680409989
2112,two children in their pajamas one has a mask and hairnet like a surgical nurse and is standing over the older child who is laying down on the wood floor,./data/resized_val_set/1680674943.jpg,1680674943
2113,a woman and a girl are sitting on a tile floor behind a wooden rack for weaving,./data/resized_val_set/1717077532.jpg,1717077532
2114,woman wearing black snow gear walking down a snow covered slope,./data/resized_val_set/172892648.jpg,172892648
2115,a man standing in a truck next to a big green metal box and two men standing below him,./data/resized_val_set/1732567333.jpg,1732567333
2116,a brown dog with a black collar stands next to a bush,./data/resized_val_set/1745110280.jpg,1745110280
2117,a brown and white dog running off of an obstacle,./data/resized_val_set/1752454466.jpg,1752454466
2118,a young tibetan boy sitting at a low table with a book,./data/resized_val_set/175369436.jpg,175369436
2119,a man in camouflage pants sits next to machinery,./data/resized_val_set/1791491934.jpg,1791491934
2120,a young child and a woman are standing around a caged rooster,./data/resized_val_set/180217379.jpg,180217379
2121,at halloween this little spiderman waits to get some candy,./data/resized_val_set/1814391289.jpg,1814391289
2122,the man is playing with his star wars light sword,./data/resized_val_set/1836335410.jpg,1836335410
2123,a woman sings into a microphone with a guitar player in the background,./data/resized_val_set/1837976956.jpg,1837976956
2124,two people are kneeling in two holes next to a couple of pails,./data/resized_val_set/1877161207.jpg,1877161207
2125,white lounge chairs are lined up at a resort for sunbathers,./data/resized_val_set/190965502.jpg,190965502
2126,some men are sitting on a boat near a beach covered in stacked logs and sticks,./data/resized_val_set/194197375.jpg,194197375
2127,a darkhaired boy carrying a large black trash bag over his shoulder,./data/resized_val_set/1944813674.jpg,1944813674
2128,a man stands in a kitchen flipping a crepe on a frying pan,./data/resized_val_set/2043372516.jpg,2043372516
2129,two jazz musicians are wearing yellow suits and performing on stage,./data/resized_val_set/205675005.jpg,205675005
2130,several people are standing near trees at dusk,./data/resized_val_set/2064780645.jpg,2064780645
2131,a dark brown dog is chewing on a stick,./data/resized_val_set/2066241589.jpg,2066241589
2132,a man in a green hat standing on a slope in front of a mountain,./data/resized_val_set/2067833088.jpg,2067833088
2133,a group of children play in the water under a bridge,./data/resized_val_set/2068403258.jpg,2068403258
2134,a woman in white with her arms folded smiling as a man is laughing holding cotton candy,./data/resized_val_set/207015505.jpg,207015505
2135,two women are teaching in front of a classroom of young children,./data/resized_val_set/2078709661.jpg,2078709661
2136,two brunette women talking to a classroom full of blond children,./data/resized_val_set/2079499010.jpg,2079499010
2137,the man has a poof on top of his woolen hat,./data/resized_val_set/2081446176.jpg,2081446176
2138,some were in a city with tall buildings and people,./data/resized_val_set/2082620071.jpg,2082620071
2139,an old man is holding up one dog while his other dog climbs on his lap,./data/resized_val_set/2082663150.jpg,2082663150
2140,three children watch a man on stage playing guitar,./data/resized_val_set/2095478050.jpg,2095478050
2141,children in yellow and orange pinnies gather in a group,./data/resized_val_set/2102902012.jpg,2102902012
2142,there is a jeep stuck in mud up to the doors,./data/resized_val_set/210625425.jpg,210625425
2143,a person wearing a hat takes a picture while its snowing,./data/resized_val_set/2109370875.jpg,2109370875
2144,a man with beard sitting down playing an acoustic guitar,./data/resized_val_set/2112114341.jpg,2112114341
2145,a white dog standing in a pool of water high in the mountains,./data/resized_val_set/2112661738.jpg,2112661738
2146,a young asian woman is jumping midair in a crowded city part,./data/resized_val_set/2113592981.jpg,2113592981
2147,three musicians standing on a stage,./data/resized_val_set/21167868.jpg,21167868
2148,four people are holding signs of protest while cars pass behind them,./data/resized_val_set/212155635.jpg,212155635
2149,a man grilling outside his house,./data/resized_val_set/2123858003.jpg,2123858003
2150,a man in a red baseball cap is leaning against a light pole,./data/resized_val_set/212536960.jpg,212536960
2151,a young boy in a yellow shirt is playing outside on monkey bars,./data/resized_val_set/212857743.jpg,212857743
2152,a smiling girl wearing a red top sits in front of her fruit plate,./data/resized_val_set/213269168.jpg,213269168
2153,two girls and a boy are walking across an intersection,./data/resized_val_set/213609234.jpg,213609234
2154,a black and white dog playing in the snow together,./data/resized_val_set/2148916767.jpg,2148916767
2155,a little redheaded girl wears a spiderman suit while riding a play horse,./data/resized_val_set/2159447283.jpg,2159447283
2156,a man is riding in a boat on the water,./data/resized_val_set/217583047.jpg,217583047
2157,two people ski in the mountains,./data/resized_val_set/2187904131.jpg,2187904131
2158,a person is jumping of a short mound in an arid setting while being filmed while another person is talking on their cellphone,./data/resized_val_set/2190899457.jpg,2190899457
2159,several people swim in a body of water,./data/resized_val_set/2192026581.jpg,2192026581
2160,four girls in bathing suit type uniforms are pictured playing volleyball outdoors,./data/resized_val_set/2206282062.jpg,2206282062
2161,man with older woman seated at table in sunny crowded area,./data/resized_val_set/2206600240.jpg,2206600240
2162,mother with two boys one acting goofy and the other giving her a kiss,./data/resized_val_set/2208310655.jpg,2208310655
2163,a yellow dog swimming in the water with something red in his mouth,./data/resized_val_set/2209496328.jpg,2209496328
2164,a car being prepared for a photo shoot,./data/resized_val_set/2209751.jpg,2209751
2165,a crowd of individuals on the beach listening to a man,./data/resized_val_set/2210054257.jpg,2210054257
2166,little boy in cami crawling on brown floor,./data/resized_val_set/2212472643.jpg,2212472643
2167,a young girl is donating money to a salvation army collection woman,./data/resized_val_set/2214383094.jpg,2214383094
2168,a dog runs in the water with a tennis ball in its mouth,./data/resized_val_set/2219805467.jpg,2219805467
2169,a man in a red shirt is standing with two fitls in front of an old structure,./data/resized_val_set/2219959872.jpg,2219959872
2170,a man and a woman are sitting at a table talking,./data/resized_val_set/2223151597.jpg,2223151597
2171,a band plays at a venue along the water,./data/resized_val_set/2224524855.jpg,2224524855
2172,two elderly woman are talking at a gathering,./data/resized_val_set/2230971412.jpg,2230971412
2173,a girl in a pink shirt is teaching a young man in a striped sweater how to knit,./data/resized_val_set/2250479700.jpg,2250479700
2174,a child sitting on a rock formation,./data/resized_val_set/2251418114.jpg,2251418114
2175,a man wearing all black and holding a green can roasts a large hotdog on a stick,./data/resized_val_set/226115048.jpg,226115048
2176,a police officer in his uniform wearing an ear piece,./data/resized_val_set/227689211.jpg,227689211
2177,there is a man in fireman gear crossing the road near a white bus and a red semi,./data/resized_val_set/2279729059.jpg,2279729059
2178,a dog is being hit by a small wave in the ocean,./data/resized_val_set/2280354512.jpg,2280354512
2179,a six piece band performs on stage,./data/resized_val_set/2281226546.jpg,2281226546
2180,there are people playing musical instrument and one other person looks like she is singing,./data/resized_val_set/2289754578.jpg,2289754578
2181,a woman plays a synthesizer in a dark room,./data/resized_val_set/2295489839.jpg,2295489839
2182,little kid with yellow jacket and blue hat jumping off rock,./data/resized_val_set/2297744130.jpg,2297744130
2183,the girl in a black shirt is reading a greeting card that was given to her by a friend of hers,./data/resized_val_set/230105501.jpg,230105501
2184,there are construction workers working hard on a project,./data/resized_val_set/2310452540.jpg,2310452540
2185,a man is shaving while sitting on the beach in front of the ocean,./data/resized_val_set/2311881432.jpg,2311881432
2186,a woman in a blue shirt unwraps a gift of a green hat,./data/resized_val_set/2315320158.jpg,2315320158
2187,two men talk to each other behind an organ while a lone woman stands to their right,./data/resized_val_set/2319963351.jpg,2319963351
2188,a man with brown hair talks on a microphone,./data/resized_val_set/2324842075.jpg,2324842075
2189,a bellhop is pushing luggage around inside a hotel,./data/resized_val_set/2326795765.jpg,2326795765
2190,a black brown and tan dog jumps at the camera,./data/resized_val_set/233361142.jpg,233361142
2191,a man in a hat is covered in concert silly string,./data/resized_val_set/2334983049.jpg,2334983049
2192,three dogs playing in the snow,./data/resized_val_set/2340206885.jpg,2340206885
2193,young adults talking under a tree on a sunny day,./data/resized_val_set/234580030.jpg,234580030
2194,a dog jumps to catch a ball in a large field,./data/resized_val_set/2353119813.jpg,2353119813
2195,an older lady in a gray and red sweater is cooking on a meal,./data/resized_val_set/2354516058.jpg,2354516058
2196,a young man is wearing a blue outfit and gray coat,./data/resized_val_set/2359784186.jpg,2359784186
2197,a female soccer player gives a teammate a piggyback ride,./data/resized_val_set/2367317953.jpg,2367317953
2198,a blond little boy wearing a robe and playing with a sword,./data/resized_val_set/2373370266.jpg,2373370266
2199,a longhaired man wearing a gray hoodie skateboards above some graffiti,./data/resized_val_set/2374523052.jpg,2374523052
2200,a man in black rolling a round table across a floor,./data/resized_val_set/2376252671.jpg,2376252671
2201,a group of people are in a boat on a large body of water,./data/resized_val_set/2382847674.jpg,2382847674
2202,black male wearing yellow shirt doing a reading with his equipment,./data/resized_val_set/2383712490.jpg,2383712490
2203,a woman throwing a white trashbag into a dumpster in front of a car,./data/resized_val_set/2386635533.jpg,2386635533
2204,a lady in red and black grins at the camera at a costume party,./data/resized_val_set/2387197355.jpg,2387197355
2205,a man rides large waves on a wind sail,./data/resized_val_set/2396025708.jpg,2396025708
2206,asian men in athletic uniforms riding the bus,./data/resized_val_set/2398915100.jpg,2398915100
2207,the truck appears to be stuck in the mud,./data/resized_val_set/2409312675.jpg,2409312675
2208,two football players bang into each other during a football game,./data/resized_val_set/241345721.jpg,241345721
2209,a football player in red and white is talking to a coach,./data/resized_val_set/241345811.jpg,241345811
2210,two young girls appear to be at attention during the national anthem,./data/resized_val_set/241347580.jpg,241347580
2211,a team manager out on the football field during a game,./data/resized_val_set/241347611.jpg,241347611
2212,a football player is in a red and white uniform sooners,./data/resized_val_set/241347803.jpg,241347803
2213,the person is doing a handstand on the beach,./data/resized_val_set/2417341107.jpg,2417341107
2214,two couples stop to take a photo,./data/resized_val_set/2417623030.jpg,2417623030
2215,a man holding and kissing a crying little boy on the cheek,./data/resized_val_set/2420730259.jpg,2420730259
2216,five people are playing various instruments in a band,./data/resized_val_set/2430018178.jpg,2430018178
2217,three young girls and a baby are sitting in the grass on a blue blanket with baby toys scattered on it,./data/resized_val_set/2434710077.jpg,2434710077
2218,a old man and a young boy are sitting at a table dressed in cultural garb,./data/resized_val_set/2439942035.jpg,2439942035
2219,a man in sunglasses is holding a child at the top of a slide,./data/resized_val_set/2445654384.jpg,2445654384
2220,a large dog running on grass with a tennis ball in his mouth,./data/resized_val_set/2463067409.jpg,2463067409
2221,four women play soccer two wearing all white and two wearing red white and blue,./data/resized_val_set/2473956981.jpg,2473956981
2222,two men go toe to toe in a martial arts competition,./data/resized_val_set/2474483208.jpg,2474483208
2223,a girl wearing a red striped shirt is about to throw a soccer ball onto a field,./data/resized_val_set/2474785004.jpg,2474785004
2224,a man sitting and holding something with his hands at a table,./data/resized_val_set/24759839.jpg,24759839
2225,the dog is playing with the stick on the beach,./data/resized_val_set/2479180530.jpg,2479180530
2226,a person rowing in their boat in the water,./data/resized_val_set/2481490320.jpg,2481490320
2227,there is nt a lot of action just a guy at a hotdog stand on normal day,./data/resized_val_set/2488783398.jpg,2488783398
2228,a man is kneeling next to a tripod and a feild of tulips,./data/resized_val_set/2490365757.jpg,2490365757
2229,two older gentlemen are interacting with one another,./data/resized_val_set/2493782805.jpg,2493782805
2230,a man a boy and a dog heading down to the ocean,./data/resized_val_set/2494088238.jpg,2494088238
2231,a man crouches in the shadow of a deflating hot air balloon,./data/resized_val_set/2500785647.jpg,2500785647
2232,a man in a white hat is looking at the camera,./data/resized_val_set/2502975562.jpg,2502975562
2233,a female getting a face tattoo of black lines and glitter,./data/resized_val_set/2504683345.jpg,2504683345
2234,a woman is watching a child while he sits on tires,./data/resized_val_set/2506113060.jpg,2506113060
2235,people are standing on a sidewalk,./data/resized_val_set/2508837436.jpg,2508837436
2236,a group of people walking through a park with signs,./data/resized_val_set/2508850304.jpg,2508850304
2237,a woman helps a little girl scrawl something on a heavilymarked banner,./data/resized_val_set/2511787709.jpg,2511787709
2238,little children are walking in a line holding each others shirts,./data/resized_val_set/2513060654.jpg,2513060654
2239,rodeo rider in cowboy clothing being bucked while riding a horse,./data/resized_val_set/2521794926.jpg,2521794926
2240,a bride and groom kissing in front of a group of people,./data/resized_val_set/2526989006.jpg,2526989006
2241,two emergency response unit workers are examining train tracks,./data/resized_val_set/2536946133.jpg,2536946133
2242,a subways worker checks the rail in a tunnel,./data/resized_val_set/2537601290.jpg,2537601290
2243,three men in orange construction vests are working in a building,./data/resized_val_set/2537665596.jpg,2537665596
2244,five mariachis playing on the street,./data/resized_val_set/2537801630.jpg,2537801630
2245,a group of men work around a set of railroad tracks with heavy equipment,./data/resized_val_set/2537817814.jpg,2537817814
2246,young adults dressed casually walk around in a field,./data/resized_val_set/2540751930.jpg,2540751930
2247,a brown dog splashing through water,./data/resized_val_set/2541104331.jpg,2541104331
2248,a man and woman walk across an empty street,./data/resized_val_set/2550027486.jpg,2550027486
2249,worker being lifted up in a cherry picker to perform work during cold weather,./data/resized_val_set/2563482243.jpg,2563482243
2250,two kids in yellow raincoats are playing in the mud,./data/resized_val_set/2565847129.jpg,2565847129
2251,a group of people riding a roller coaster upside down,./data/resized_val_set/2579268572.jpg,2579268572
2252,a woman and child are sitting in a chair,./data/resized_val_set/2579699529.jpg,2579699529
2253,a group of people stand in a line on the concrete tiles,./data/resized_val_set/2580215443.jpg,2580215443
2254,an woman in a red swim cap and black goggles swims laps in her lane,./data/resized_val_set/2592398210.jpg,2592398210
2255,boy in tan hat laughs while sitting near playground equipment,./data/resized_val_set/2594042571.jpg,2594042571
2256,a little girl stands in a puddle of water in the middle of the street,./data/resized_val_set/2594459477.jpg,2594459477
2257,a redhaired child is eating something,./data/resized_val_set/2597088734.jpg,2597088734
2258,four young adults are working on an upside down bicycle in a park,./data/resized_val_set/2600229816.jpg,2600229816
2259,a long brownhaired dog walking through a river,./data/resized_val_set/2613209320.jpg,2613209320
2260,a dog running across a field with a ball in its mouth,./data/resized_val_set/2613993276.jpg,2613993276
2261,a group of people waiting outside a fenced in area,./data/resized_val_set/2621771656.jpg,2621771656
2262,a child in a red shirt hangs upside down from a tree branch,./data/resized_val_set/262439544.jpg,262439544
2263,two people are paying to play a basketball carnival game,./data/resized_val_set/2632429064.jpg,2632429064
2264,a smiling child in a bright orange and blue shirt sitting among peers,./data/resized_val_set/2636663855.jpg,2636663855
2265,two young boys are outside talking and are nt wearing shirts,./data/resized_val_set/2638054798.jpg,2638054798
2266,a man in a red jacket stands next to a yellow kayak on rocks by the ocean,./data/resized_val_set/2641770481.jpg,2641770481
2267,groups of people are walking out a short dark tunnel,./data/resized_val_set/2644302353.jpg,2644302353
2268,a blond girl is sitting at a bar in the presence of three other men,./data/resized_val_set/264461048.jpg,264461048
2269,a little blond boy jumps from one bed to another,./data/resized_val_set/2647394564.jpg,2647394564
2270,a little boy holds a bat in the air waiting on the ball,./data/resized_val_set/2648165716.jpg,2648165716
2271,a man standing in front of dale jr posters with red light,./data/resized_val_set/264928854.jpg,264928854
2272,two housewives are chatting next to a small child,./data/resized_val_set/2654018684.jpg,2654018684
2273,a woman in a blue shirt is playing an instrument,./data/resized_val_set/2669048370.jpg,2669048370
2274,people gather in a chinese street corner at night in the city,./data/resized_val_set/26758039.jpg,26758039
2275,man with sunglasses sitting in shallow water,./data/resized_val_set/2676015068.jpg,2676015068
2276,a woman watches as a man in a white shirt and pants ties something around a wooden stump,./data/resized_val_set/268044066.jpg,268044066
2277,four teenagers in gothic clothes are walking in a neighborhood,./data/resized_val_set/269361490.jpg,269361490
2278,people are strapped to an amusement park ride,./data/resized_val_set/2705925058.jpg,2705925058
2279,a guy with no shirt on is skateboarding,./data/resized_val_set/2712352554.jpg,2712352554
2280,a man builds an elaborate sand castle on the beach,./data/resized_val_set/2723024306.jpg,2723024306
2281,two brown dogs run through the grass together,./data/resized_val_set/2723477522.jpg,2723477522
2282,men with their hands raised are wearing karate uniforms,./data/resized_val_set/272354004.jpg,272354004
2283,a woman thows a frisbee to a dog as a baseball player in uniform runs behind her,./data/resized_val_set/2734669176.jpg,2734669176
2284,a black dog is carrying a white dog toy through a field of high grass,./data/resized_val_set/274313927.jpg,274313927
2285,a lot of men and motorcycles float on a canoe,./data/resized_val_set/2744330402.jpg,2744330402
2286,a large column of bicyclists is cycling down a road,./data/resized_val_set/2744600462.jpg,2744600462
2287,artist showing off his work of women faces and hair,./data/resized_val_set/275171617.jpg,275171617
2288,man in black hat and woman in pink dress walk down city street outside a bar,./data/resized_val_set/275854404.jpg,275854404
2289,a man in a white tshirt painting in the middle of a stone paved road,./data/resized_val_set/2761119252.jpg,2761119252
2290,a dog looking up a tree with his tongue hanging out,./data/resized_val_set/2766630484.jpg,2766630484
2291,a man in blue and red face paint poses for a picture with a woman,./data/resized_val_set/2771424045.jpg,2771424045
2292,two young boys play marbles at the bottom of a stairwell,./data/resized_val_set/2774025309.jpg,2774025309
2293,two men sit in the backseat of a car and one is looking back at the camera pointing,./data/resized_val_set/2774267559.jpg,2774267559
2294,a little boy on a swing,./data/resized_val_set/2777021428.jpg,2777021428
2295,a shirtless man has his arms wide open near a waterfall,./data/resized_val_set/2793597468.jpg,2793597468
2296,person with a red backpackers going for a hike,./data/resized_val_set/2800531753.jpg,2800531753
2297,an asian man sitting in a boat with a wide variety of fruit around him,./data/resized_val_set/2808838598.jpg,2808838598
2298,a mass of people looking and moving in the same general direction,./data/resized_val_set/2833509990.jpg,2833509990
2299,three women wearing robes and hats stand in a street with a yellow dog,./data/resized_val_set/2849169944.jpg,2849169944
2300,a man in a white and blue shirt is making a kabob,./data/resized_val_set/2864577025.jpg,2864577025
2301,girl wearing a pink wig standing on the shore of a beach,./data/resized_val_set/2866974237.jpg,2866974237
2302,a man looking back at a blond woman smoking in the street,./data/resized_val_set/2872778569.jpg,2872778569
2303,a man holding a shovel above his head is posing in front of a campfire,./data/resized_val_set/2879966085.jpg,2879966085
2304,a man sticking his tongue at a woman close to her face,./data/resized_val_set/2881561370.jpg,2881561370
2305,two children in coats walking in a park,./data/resized_val_set/288177922.jpg,288177922
2306,the young girl is given rabbit ears by the young boy behind her,./data/resized_val_set/2884092603.jpg,2884092603
2307,a baby wears a fleece magenta outfit while she lays in the leaves,./data/resized_val_set/289560545.jpg,289560545
2308,a girl with redhair and red eyebrows appears to be in midspeach,./data/resized_val_set/2895700779.jpg,2895700779
2309,a man in a green top and gloves trots across a ball field,./data/resized_val_set/289625522.jpg,289625522
2310,a dog with a bandanna jumps through hoop,./data/resized_val_set/2896640216.jpg,2896640216
2311,a group of children are sitting crosslegged in a classroom,./data/resized_val_set/2908834379.jpg,2908834379
2312,a sailor stands at the entrance of a historical wooden shop talking to two men,./data/resized_val_set/2917463531.jpg,2917463531
2313,a large yellow dog leaps into the air to catch his frisbee,./data/resized_val_set/2922807898.jpg,2922807898
2314,a man falling asleep while sitting down,./data/resized_val_set/2923605305.jpg,2923605305
2315,black dog jumping out of the water with a stick in his mouth,./data/resized_val_set/2934000107.jpg,2934000107
2316,two dogs run on either side of a road opposite from one another,./data/resized_val_set/295258727.jpg,295258727
2317,people outside talking near a beach with a small girl,./data/resized_val_set/2953704682.jpg,2953704682
2318,a small group of people with their camels are resting outside of a small village,./data/resized_val_set/2955083038.jpg,2955083038
2319,four dogs are playing in a circle and one black dog is walking away,./data/resized_val_set/2956562716.jpg,2956562716
2320,a uniformed member of the us military speaks into a microphone,./data/resized_val_set/2957679856.jpg,2957679856
2321,two women standing in front of a car with a camera crew near them,./data/resized_val_set/2957702898.jpg,2957702898
2322,an swimmer swimming in a swimming pool,./data/resized_val_set/2966901532.jpg,2966901532
2323,a woman in a white outfit is lying on a coach reading a book,./data/resized_val_set/2972245986.jpg,2972245986
2324,a group of people are getting together for some fun and dancing,./data/resized_val_set/2972901053.jpg,2972901053
2325,slanted picture of girl blowing bubbles,./data/resized_val_set/2977103313.jpg,2977103313
2326,a group of darkhaired children are standing in a field,./data/resized_val_set/2977128559.jpg,2977128559
2327,the boy wearing a red sweatshirt is jumping off a pile of hay,./data/resized_val_set/2978394277.jpg,2978394277
2328,a boy jumping a rail on his skateboard,./data/resized_val_set/2990977776.jpg,2990977776
2329,a man reaches up to work with cables above a desk,./data/resized_val_set/2993822651.jpg,2993822651
2330,baby asian child eating food while wearing a red flowery bib,./data/resized_val_set/2997191641.jpg,2997191641
2331,two girls and two boys are walking down a road with backpacks on their backs,./data/resized_val_set/3002051747.jpg,3002051747
2332,a man with dreadlocks is plugging his ear to hear a phone call,./data/resized_val_set/3004291093.jpg,3004291093
2333,two men work with machinery in a factory wearing plastic aprons and gloves,./data/resized_val_set/300438143.jpg,300438143
2334,a dog in a grassy field looking up,./data/resized_val_set/3004823335.jpg,3004823335
2335,a woman and a boy playing a board game at a table,./data/resized_val_set/3009713124.jpg,3009713124
