,caption,image_file,image_id
3265,a group of people riding a yellow roller coaster,./data/resized_val_set/2579268572.jpg,2579268572
3266,a woman and little boy share a chair,./data/resized_val_set/2579699529.jpg,2579699529
3267,a group of people are standing together on the pavement,./data/resized_val_set/2580215443.jpg,2580215443
3268,a young girl is swimming in a pool,./data/resized_val_set/2592398210.jpg,2592398210
3269,a little boy in a tan hat on the ground of a play area,./data/resized_val_set/2594042571.jpg,2594042571
3270,a little girl stands in a puddle outside,./data/resized_val_set/2594459477.jpg,2594459477
3271,a young girl eating a treat,./data/resized_val_set/2597088734.jpg,2597088734
3272,four people collaborate on repairing a bicycle,./data/resized_val_set/2600229816.jpg,2600229816
3273,a wet dog walks out of the water,./data/resized_val_set/2613209320.jpg,2613209320
3274,a dog in a grass field runs with a ball in its mouth,./data/resized_val_set/2613993276.jpg,2613993276
3275,a group of people wait behind a metal fence,./data/resized_val_set/2621771656.jpg,2621771656
3276,a boy in a red top is hanging upside down from a tree,./data/resized_val_set/262439544.jpg,262439544
3277,a young couple enjoying a game at a street fair,./data/resized_val_set/2632429064.jpg,2632429064
3278,a boy smiles for the camera in a group of sitting children,./data/resized_val_set/2636663855.jpg,2636663855
3279,two children without shirts on sit at the edge of a fountain,./data/resized_val_set/2638054798.jpg,2638054798
3280,a man pulls on his sweater as a kayak lays at his feet,./data/resized_val_set/2641770481.jpg,2641770481
3281,a man walks a few feet in front of a family,./data/resized_val_set/2644302353.jpg,2644302353
3282,a disinterested young woman and an older man stand by a bar,./data/resized_val_set/264461048.jpg,264461048
3283,a young blond boy is jumping from bed to bed,./data/resized_val_set/2647394564.jpg,2647394564
3284,a small child swings back a red baseball bat,./data/resized_val_set/2648165716.jpg,2648165716
3285,a man is talking on a cellphone outside of a bar,./data/resized_val_set/264928854.jpg,264928854
3286,various people sitting and talking in a room,./data/resized_val_set/2654018684.jpg,2654018684
3287,a young girl playing clarinet in a musical group,./data/resized_val_set/2669048370.jpg,2669048370
3288,this is a crowded intersection in a big city at night,./data/resized_val_set/26758039.jpg,26758039
3289,a person is sitting in a shallow lagoon,./data/resized_val_set/2676015068.jpg,2676015068
3290,a man touches a tall tree stump while a woman watches,./data/resized_val_set/268044066.jpg,268044066
3291,four people dressed in black clothing stand together outside,./data/resized_val_set/269361490.jpg,269361490
3292,two boys and two girls strapped into a ride,./data/resized_val_set/2705925058.jpg,2705925058
3293,skater does a trick on a rail,./data/resized_val_set/2712352554.jpg,2712352554
3294,man builds detailed sand castle on the beach,./data/resized_val_set/2723024306.jpg,2723024306
3295,a big dog chases a little dog on the grass,./data/resized_val_set/2723477522.jpg,2723477522
3296,men in white outfits are holding up their hands,./data/resized_val_set/272354004.jpg,272354004
3297,the girl does freestyle frisbee tricks with her dog at the baseball park,./data/resized_val_set/2734669176.jpg,2734669176
3298,a black dog with a white toy in his mouth in a field of grass,./data/resized_val_set/274313927.jpg,274313927
3299,a brown boat is packed with goods and people,./data/resized_val_set/2744330402.jpg,2744330402
3300,a pack of bicycle road racers lean through a curve,./data/resized_val_set/2744600462.jpg,2744600462
3301,two women and a man are seated at an artist booth,./data/resized_val_set/275171617.jpg,275171617
3302,a white woman and black man walking down the street,./data/resized_val_set/275854404.jpg,275854404
3303,a man painting a picture as other people walk down the road,./data/resized_val_set/2761119252.jpg,2761119252
3304,a brown black and white dog barking up a tree,./data/resized_val_set/2766630484.jpg,2766630484
3305,a young woman poses with a man in face paint,./data/resized_val_set/2771424045.jpg,2771424045
3306,two young boys are holding green marbles,./data/resized_val_set/2774025309.jpg,2774025309
3307,two men driving in a car while one is pointing,./data/resized_val_set/2774267559.jpg,2774267559
3308,a boy rides a swing,./data/resized_val_set/2777021428.jpg,2777021428
3309,a man bathes in a waterfall as another man looks on,./data/resized_val_set/2793597468.jpg,2793597468
3310,a hiker is standing on the side of a mountain,./data/resized_val_set/2800531753.jpg,2800531753
3311,a woman is on a boat with many types of fruit,./data/resized_val_set/2808838598.jpg,2808838598
3312,there is a crowd of people standing in a the midst of the city,./data/resized_val_set/2833509990.jpg,2833509990
3313,three women in oldfashioned clothing stand in the street with a dog,./data/resized_val_set/2849169944.jpg,2849169944
3314,a man in a white shirt is making shish kabob,./data/resized_val_set/2864577025.jpg,2864577025
3315,a person with pink hair looking out at a beach,./data/resized_val_set/2866974237.jpg,2866974237
3316,man looking at a woman that is smoking on the sidewalk,./data/resized_val_set/2872778569.jpg,2872778569
3317,man with shovel claiming victory over the fire pit,./data/resized_val_set/2879966085.jpg,2879966085
3318,a man licking the face of a woman wearing glasses,./data/resized_val_set/2881561370.jpg,2881561370
3319,one boy follows another at the park,./data/resized_val_set/288177922.jpg,288177922
3320,a girl smiles while a boy makes a v sign behind her head,./data/resized_val_set/2884092603.jpg,2884092603
3321,baby in a pink onesie is laying down in a pile of leaves,./data/resized_val_set/289560545.jpg,289560545
3322,a closeup of a woman with short redhair,./data/resized_val_set/2895700779.jpg,2895700779
3323,a soccer player in a green uniform is running,./data/resized_val_set/289625522.jpg,289625522
3324,a girl leads her dog over a hurdle,./data/resized_val_set/2896640216.jpg,2896640216
3325,children in a classroom sitting on a numbered rug,./data/resized_val_set/2908834379.jpg,2908834379
3326,sailors stand at the top of a gangplank to a large boat,./data/resized_val_set/2917463531.jpg,2917463531
3327,a yellow dog is jumping to catch a toy in a park,./data/resized_val_set/2922807898.jpg,2922807898
3328,a man in a gray tshirt rests,./data/resized_val_set/2923605305.jpg,2923605305
3329,a black dog is swimming through water,./data/resized_val_set/2934000107.jpg,2934000107
3330,two black dogs running down either side of a paved pathway,./data/resized_val_set/295258727.jpg,295258727
3331,four people in a sandy area holding black trash bags,./data/resized_val_set/2953704682.jpg,2953704682
3332,people and camels taking a break in the desert,./data/resized_val_set/2955083038.jpg,2955083038
3333,several dogs of different breeds play in a backyard,./data/resized_val_set/2956562716.jpg,2956562716
3334,a man in an army uniform speaks into a microphone,./data/resized_val_set/2957679856.jpg,2957679856
3335,two young ladies in blocking the smart car display at an auto show,./data/resized_val_set/2957702898.jpg,2957702898
3336,a person with goggles on swimming,./data/resized_val_set/2966901532.jpg,2966901532
3337,a woman dressed in white pauses while reading her book,./data/resized_val_set/2972245986.jpg,2972245986
3338,one man is making hand signals next to two young girls,./data/resized_val_set/2972901053.jpg,2972901053
3339,a girl blows bubbles in a dimly lit room,./data/resized_val_set/2977103313.jpg,2977103313
3340,boys and girls from an eastern nation smiling in a field,./data/resized_val_set/2977128559.jpg,2977128559
3341,a kid jumps off a haystack while other kids watch,./data/resized_val_set/2978394277.jpg,2978394277
3342,boy doing tricks on a skateboard,./data/resized_val_set/2990977776.jpg,2990977776
3343,a man in jeans working with cables on a desk,./data/resized_val_set/2993822651.jpg,2993822651
3344,a baby in a purple shirt eating a cheese stick,./data/resized_val_set/2997191641.jpg,2997191641
3345,four children walking down a street turn to look at the camera,./data/resized_val_set/3002051747.jpg,3002051747
3346,a man with crazy hair is sitting with his fingers in his ears,./data/resized_val_set/3004291093.jpg,3004291093
3347,two men wearing plastic aprons are working in an industrial setting,./data/resized_val_set/300438143.jpg,300438143
3348,a dog looking up in a grassy field,./data/resized_val_set/3004823335.jpg,3004823335
3349,two kids playing a board game on a table,./data/resized_val_set/3009713124.jpg,3009713124
3350,kids sit on a ledge and converse,./data/resized_val_set/301582255.jpg,301582255
3351,a brown dog leaps in the air over colorful leafs,./data/resized_val_set/3019857541.jpg,3019857541
3352,two men are painting a building while a third is walking past on his cellphone,./data/resized_val_set/3020218156.jpg,3020218156
3353,a group of men are engaged in dialogue at work,./data/resized_val_set/3020578684.jpg,3020578684
3354,two girls smiling while looking at there camera,./data/resized_val_set/3023753964.jpg,3023753964
3355,a woman with her middle finger up in the air,./data/resized_val_set/3026459445.jpg,3026459445
3356,a white and brown dog runs in a field,./data/resized_val_set/3028561714.jpg,3028561714
3357,people are sitting in class one female is reading a book,./data/resized_val_set/303103036.jpg,303103036
3358,two small girls walk along the leaves,./data/resized_val_set/3036382555.jpg,3036382555
3359,a woman in white dress is fixing the flower on a man suit,./data/resized_val_set/3037060954.jpg,3037060954
3360,a woman and a man dresses up and smiling with a bouquet of flowers between them,./data/resized_val_set/3037108254.jpg,3037108254
3361,two people walking with strollers through a park,./data/resized_val_set/3041262779.jpg,3041262779
3362,four women pose in their alien costumes,./data/resized_val_set/3046431231.jpg,3046431231
3363,a old woman sits on a bench next to her cane,./data/resized_val_set/3047788420.jpg,3047788420
3364,girls in black bikinis playing beach volleyball,./data/resized_val_set/3048904615.jpg,3048904615
3365,there is a man swimming with a child,./data/resized_val_set/3051022611.jpg,3051022611
3366,a boy stands as a girl on each side of him jumps during autumn in the wilderness,./data/resized_val_set/3052412278.jpg,3052412278
3367,a woman wearing black moving things on ice,./data/resized_val_set/305673358.jpg,305673358
3368,a person is carrying many bags,./data/resized_val_set/3061422245.jpg,3061422245
3369,a boy standing in front of a multicolored statue,./data/resized_val_set/3085973779.jpg,3085973779
3370,a guy in a light brown shirt smile at the camera,./data/resized_val_set/3087225132.jpg,3087225132
3371,a boy standing next to a desk in classroom,./data/resized_val_set/3087336221.jpg,3087336221
3372,a man wakeboards in the water,./data/resized_val_set/3088572348.jpg,3088572348
3373,four children looking out a window,./data/resized_val_set/3091921457.jpg,3091921457
3374,a man with glasses wearing all black sits on grass surrounded by other people,./data/resized_val_set/3091962081.jpg,3091962081
3375,a girl in a pink bathing suit is doing an aerial split on a beach,./data/resized_val_set/3093325656.jpg,3093325656
3376,a couple of men walking on a public city street,./data/resized_val_set/3093744301.jpg,3093744301
3377,a man doing tricks on a bicycle,./data/resized_val_set/3100442775.jpg,3100442775
3378,a man in a blue jacket and gloves is standing in the street among other people,./data/resized_val_set/3103231330.jpg,3103231330
3379,a woman in a yellow tshirt and sunglasses walks down a sidewalk,./data/resized_val_set/3106857210.jpg,3106857210
3380,two women look out at many houses below,./data/resized_val_set/3107558821.jpg,3107558821
3381,two dogs running through high grass,./data/resized_val_set/3110018626.jpg,3110018626
3382,women in long skirts and jackets dancing in the back of a mcdonald,./data/resized_val_set/3111897772.jpg,3111897772
3383,people sitting in a dining room,./data/resized_val_set/311379220.jpg,311379220
3384,a woman wearing a black tshirt appears to being going up a escalator,./data/resized_val_set/3121771055.jpg,3121771055
3385,men women and children dance at a party,./data/resized_val_set/3122369444.jpg,3122369444
3386,a man and woman pose together on a cobblestone street,./data/resized_val_set/3125158798.jpg,3125158798
3387,two dogs playing in the snow,./data/resized_val_set/3127142756.jpg,3127142756
3388,the dog is jumping in the air,./data/resized_val_set/3139389284.jpg,3139389284
3389,a musician is on stage and playing a sixstring bass guitar,./data/resized_val_set/314454989.jpg,314454989
3390,a boy and an old man with a cane are talking,./data/resized_val_set/3147399239.jpg,3147399239
3391,a woman in a gym is about to hit a volleyball serve,./data/resized_val_set/3148098037.jpg,3148098037
3392,a man in a black hoodie watching a man in a red cap,./data/resized_val_set/3150742439.jpg,3150742439
3393,a child in shorts throws a snowball at a mountain,./data/resized_val_set/3157039116.jpg,3157039116
3394,a person is hang gliding in the ocean,./data/resized_val_set/3171035252.jpg,3171035252
3395,two men in royal uniform and headdress are riding horses,./data/resized_val_set/317386541.jpg,317386541
3396,a dog runs through the deep snow,./data/resized_val_set/317488612.jpg,317488612
3397,a large group portrate outside of a small office building,./data/resized_val_set/3179952488.jpg,3179952488
3398,a dog sits on a red blanket with a man in a dark hoodie,./data/resized_val_set/3183777589.jpg,3183777589
3399,two people smile at the camera while holding a sign,./data/resized_val_set/3183883750.jpg,3183883750
3400,a child is having fun sledding with his mother,./data/resized_val_set/3186265813.jpg,3186265813
3401,a man reading a cookbook and making the recipe,./data/resized_val_set/3186472721.jpg,3186472721
3402,a girl in white playing the electric bass,./data/resized_val_set/3186685756.jpg,3186685756
3403,snowboarders sit on a chairlift,./data/resized_val_set/3200120942.jpg,3200120942
3404,several people are standing in a room eating,./data/resized_val_set/3203286634.jpg,3203286634
3405,a street musician performs at a subway entrance,./data/resized_val_set/3204579636.jpg,3204579636
3406,a guy grinds a windowsill near an old windmill,./data/resized_val_set/3215238223.jpg,3215238223
3407,a blond woman in a white shirt demonstrates her talents to a crowd,./data/resized_val_set/3216316010.jpg,3216316010
3408,one older man interviews another in a racing suit,./data/resized_val_set/3225025519.jpg,3225025519
3409,two people dressed in pink,./data/resized_val_set/3226541300.jpg,3226541300
3410,a young boy riding a dirt bike through the mud,./data/resized_val_set/3228517564.jpg,3228517564
3411,a child bolts from a bench down a city street,./data/resized_val_set/3230602641.jpg,3230602641
3412,little girl is disinterested by what entices the crowd,./data/resized_val_set/3237799755.jpg,3237799755
3413,two old men sitting down resting,./data/resized_val_set/3239891140.jpg,3239891140
3414,two children are playing in a homemade fort,./data/resized_val_set/3245266444.jpg,3245266444
3415,a woman kneeling in the snow attaching a harness on a small tan dog,./data/resized_val_set/3251234434.jpg,3251234434
3416,two men are setting up some electronic equpitment,./data/resized_val_set/3259222980.jpg,3259222980
3417,man sleeping on the subway holding a bag,./data/resized_val_set/3267720211.jpg,3267720211
3418,picture of biker in midair of a jump,./data/resized_val_set/3268191118.jpg,3268191118
3419,two men sitting in sand reading magazines,./data/resized_val_set/3281225560.jpg,3281225560
3420,several men standing in front of graffiti,./data/resized_val_set/3283021089.jpg,3283021089
3421,person with red shirt and black pants climbing a rock,./data/resized_val_set/3288839246.jpg,3288839246
3422,a man on a very tall bike rides across a crosswalk,./data/resized_val_set/3288928346.jpg,3288928346
3423,two dogs playing in the grass,./data/resized_val_set/3292277400.jpg,3292277400
3424,a person wearing an orange coat is walking past a building,./data/resized_val_set/3294336227.jpg,3294336227
3425,older indian woman uses a loom while smoking a pipe,./data/resized_val_set/3298378599.jpg,3298378599
3426,two men wearing warm clothing are jumping beside a fence,./data/resized_val_set/3298547199.jpg,3298547199
3427,a bespectacled man speaks into a microphone under red neon lighting,./data/resized_val_set/3300643106.jpg,3300643106
3428,a child with a green shirt is holding a red ball against its mouth,./data/resized_val_set/3304763517.jpg,3304763517
3429,the person with the tattoos is holding a dirty frying pan,./data/resized_val_set/3306464579.jpg,3306464579
3430,four people in a band are performing,./data/resized_val_set/3310851569.jpg,3310851569
3431,a group of young men are running a race,./data/resized_val_set/3313691449.jpg,3313691449
3432,person toting items at a market,./data/resized_val_set/3321248380.jpg,3321248380
3433,three dogs are in the snow,./data/resized_val_set/3324375078.jpg,3324375078
3434,a white bird flies over a lake,./data/resized_val_set/3325578605.jpg,3325578605
3435,a group of people gathered at a school,./data/resized_val_set/3325960085.jpg,3325960085
3436,a yellow car drives across a snowy path,./data/resized_val_set/3326024473.jpg,3326024473
3437,band practice is cramped quarters,./data/resized_val_set/3333039854.jpg,3333039854
3438,men and women sit in a meeting and listen to a presentation,./data/resized_val_set/3335127933.jpg,3335127933
3439,a woman showing a powerpoint presentation on a large projector screen,./data/resized_val_set/3335873796.jpg,3335873796
3440,young people are engaged in a game,./data/resized_val_set/3335885203.jpg,3335885203
3441,a baseball player swings at a baseball,./data/resized_val_set/3339319023.jpg,3339319023
3442,a mother and her sons look at an information kiosk,./data/resized_val_set/3340639621.jpg,3340639621
3443,some men are finishing a race,./data/resized_val_set/3342445722.jpg,3342445722
3444,two women are standing with ski poles in deep snow,./data/resized_val_set/3344175369.jpg,3344175369
3445,group of people outside with a woman in a red jacket and wearing a green scarf,./data/resized_val_set/3344578125.jpg,3344578125
3446,a child skis across the snowy ground,./data/resized_val_set/3344798356.jpg,3344798356
3447,why are nt these girls in the kitchen instead of playing with toys,./data/resized_val_set/334890559.jpg,334890559
3448,two young girls ride a camel near water,./data/resized_val_set/3351704877.jpg,3351704877
3449,various people are talking together at a bar,./data/resized_val_set/3353950389.jpg,3353950389
3450,crowd on sidewalk waiting to go inside a store,./data/resized_val_set/3354463693.jpg,3354463693
3451,two boys pose for a picture with their rickshaw,./data/resized_val_set/3361278843.jpg,3361278843
3452,a little brown dog runs through the grass,./data/resized_val_set/336460583.jpg,336460583
3453,people sitting in a welllit restaurant,./data/resized_val_set/3366571152.jpg,3366571152
3454,a snowboarder is doing a trick,./data/resized_val_set/3368819708.jpg,3368819708
3455,an asian ups worker is stacking brown boxes,./data/resized_val_set/3384702365.jpg,3384702365
3456,a woman in a blue shirt is riding a bicycle,./data/resized_val_set/3385430506.jpg,3385430506
3457,a woman in a white tennis outfit is jumping up to hit the ball,./data/resized_val_set/3388094307.jpg,3388094307
3458,a woman plays the cello while looking on,./data/resized_val_set/3388618374.jpg,3388618374
3459,two older men in dark sweaters are standing on a sidewalk,./data/resized_val_set/3393274529.jpg,3393274529
3460,a woman holding a white and black dog,./data/resized_val_set/3394654132.jpg,3394654132
3461,a boy in a red shirt trying to play a guitar,./data/resized_val_set/3394992905.jpg,3394992905
3462,a young clerk looking for new emails from clients,./data/resized_val_set/3395176505.jpg,3395176505
3463,three woman are sitting in front of a decorated tree,./data/resized_val_set/339642119.jpg,339642119
3464,a white fluffy dog is jumping and catching a toy,./data/resized_val_set/3396817186.jpg,3396817186
3465,a matador in a colorful outfit is riding a bull,./data/resized_val_set/3405759441.jpg,3405759441
3466,children are bathing in the falling water,./data/resized_val_set/3410899419.jpg,3410899419
3467,a dog barks at plants in a walled concrete courtyard,./data/resized_val_set/3415165462.jpg,3415165462
3468,a group of people in blue shirts at a sporting event,./data/resized_val_set/3416617727.jpg,3416617727
3469,a tennis player is carrying a tennis racket,./data/resized_val_set/3425851292.jpg,3425851292
3470,two little girls in blue dresses laugh,./data/resized_val_set/3427023324.jpg,3427023324
3471,a little girl in a dancing class,./data/resized_val_set/3433259846.jpg,3433259846
3472,two women jump in the grass atop a mountain,./data/resized_val_set/3435015880.jpg,3435015880
3473,thai dancers happily going through their steps in unison,./data/resized_val_set/3435208408.jpg,3435208408
3474,a guy racing his motorcycle on a trail,./data/resized_val_set/3435233065.jpg,3435233065
3475,a woman in a pink jacket walks down the sidewalk,./data/resized_val_set/3435371117.jpg,3435371117
3476,woman standing on a brick wall and taking a picture,./data/resized_val_set/3445428367.jpg,3445428367
3477,a white female wearing white shorts and yellow top throws a stick in a nature scene,./data/resized_val_set/344865045.jpg,344865045
3478,a motorcyclist biking through dusty terrain,./data/resized_val_set/3450158776.jpg,3450158776
3479,a girl is crouched in a bucket eating a popsicle,./data/resized_val_set/3451623753.jpg,3451623753
3480,two furry light brown dogs lying on a hardwood floor,./data/resized_val_set/3458577912.jpg,3458577912
3481,a young boy is using a garden hose to water a small tree,./data/resized_val_set/3460992366.jpg,3460992366
3482,a boy rides his bike on a halfpipe,./data/resized_val_set/3463034205.jpg,3463034205
3483,an old man wearing a black jacket is looking on the table,./data/resized_val_set/3463342991.jpg,3463342991
3484,two men are walking in a street of stone on a nice day,./data/resized_val_set/3470703538.jpg,3470703538
3485,a woman hanging from a tree her leg wrapped in cloth,./data/resized_val_set/347186933.jpg,347186933
3486,a young girl in blue and a bicycle helmet is walking across a log in a pond,./data/resized_val_set/3473635435.jpg,3473635435
3487,a black dog jumping over an obstacle,./data/resized_val_set/3474999131.jpg,3474999131
3488,a soccer player is about to kick the ball near the goal,./data/resized_val_set/3477672764.jpg,3477672764
3489,a group of men who have bicycles are chatting,./data/resized_val_set/3481556478.jpg,3481556478
3490,a man running away from a charging bull,./data/resized_val_set/3482314155.jpg,3482314155
3491,a boy with a mohawk chasing geese in a park,./data/resized_val_set/3486324591.jpg,3486324591
3492,a brown and white dog jumps on the sidewalk,./data/resized_val_set/3488087117.jpg,3488087117
3493,two children putting heads through novelty photo board,./data/resized_val_set/3498240367.jpg,3498240367
3494,the shadow of two men on rigging,./data/resized_val_set/34988312.jpg,34988312
3495,two dogs play in the yellow grass with a ball,./data/resized_val_set/3500342526.jpg,3500342526
3496,a group of people loitering around a trashcan,./data/resized_val_set/3503021545.jpg,3503021545
3497,a white dog is running into a river,./data/resized_val_set/3504275465.jpg,3504275465
3498,a photographer taking a photo of a message on a set of doors,./data/resized_val_set/3505701438.jpg,3505701438
3499,a toddler holds a large blue ball while playing in the grass,./data/resized_val_set/3508389675.jpg,3508389675
3500,a man practicing boxing,./data/resized_val_set/3510218982.jpg,3510218982
3501,seven people are jumping in the air along the shore,./data/resized_val_set/3520079657.jpg,3520079657
3502,a curlyhaired woman plays the violin,./data/resized_val_set/3520199925.jpg,3520199925
3503,some people climbing a mountain,./data/resized_val_set/3525041739.jpg,3525041739
3504,a man wearing a gray shirt is doing a skateboard trick on stairs,./data/resized_val_set/3541483943.jpg,3541483943
3505,three men walking next to a tent with a billboard sign on it,./data/resized_val_set/3553374585.jpg,3553374585
3506,a girl picking dandelions in a grassy meadow,./data/resized_val_set/3560771491.jpg,3560771491
3507,young boy delivers a jumping martial arts kick,./data/resized_val_set/356242936.jpg,356242936
3508,a man and woman playing a game outside,./data/resized_val_set/3562537872.jpg,3562537872
3509,a girl in a white dress running,./data/resized_val_set/3569329986.jpg,3569329986
3510,a woman with purple hair and a man in military regalia,./data/resized_val_set/3569420080.jpg,3569420080
3511,people having fun at a party,./data/resized_val_set/3571996084.jpg,3571996084
3512,a man stare at a passing couple while walking down the block,./data/resized_val_set/3572548523.jpg,3572548523
3513,a younger man is playing a organ as an older man watches,./data/resized_val_set/3575947093.jpg,3575947093
3514,a large group of people watching a performer on a stage,./data/resized_val_set/3578318751.jpg,3578318751
3515,a red and white race car racing on a dirt racetrack,./data/resized_val_set/3578841731.jpg,3578841731
3516,a group of people listening to a man talking outside,./data/resized_val_set/3578945620.jpg,3578945620
3517,a man leaning against another man with his eyes closed,./data/resized_val_set/3579150322.jpg,3579150322
3518,a soccer player runs for a soccer ball,./data/resized_val_set/3580375310.jpg,3580375310
